,index,title,score,id,subreddit,url,num_comments,body,created,date_created,month
629,629,Can't get any kind of job. What happens to people like me?,137,fo246f,careerguidance,https://www.reddit.com/r/careerguidance/comments/fo246f/cant_get_any_kind_of_job_what_happens_to_people/,81,"I'm in my early-mid twenties and I've never had a job.

Without getting into too much detail, I've had a problem throughout my entire life which had disallowed me from participating effectively in any kind of institutional setting. I would summarize the problem by saying that I can't deal with ambiguity. In school, I would sometimes not turn in work that I had already done because I wasn't exactly sure where or how to turn it in, and I was too afraid to ask. That's an extreme case, but I had lots of other smaller issues like that. Not sure of how to do some kind of project that they provided little to no information on the specifics of. I'm sure people can relate, but the difference between you and me is that you seem to be able to bs your way through it and find some way to figure out what they're trying to ask you to do.

I was homeschooled for a lot of my life, and my problems with ambiguous instructions began in 4th grade where I attended a public school for the first time. I also have pretty bad social anxiety and I generally lack common sense in a lot of areas, leading to various other problems functioning. I would go into more detail but it seems unnecessary for now. The basic point I'm trying to make is that I can't deal with normal institutional scenarios. I'm pretty intelligent and pretty talented in some areas, but when an obligation presents itself in the form of an institution, that's when I can't deal with it. I don't want to deal with it but I also can't. Somehow, when a bunch of bureaucrats or a bunch of profiteers get involved in some sort of activity, they turn the activity itself into a secondary goal. The main goal is to fulfill the bureaucracy's requirements, or to suck up to the right people, or to help your boss make profit. No one wants me to do some task for the sake of simply doing the task, and I think the spirit of that situation is just very difficult for me to function in, and the ambiguous instructions that come up in that situation are just the cherry on top, guaranteeng that I won't be able to do what the job is asking. As an example, I'm somewhat talented at computer security, and I enjoy messing around on my own with it, but in an employment scenario, instead of just doing what needs to be done, I'm suddenly gonna have to write a report, and present a slideshow, or some other bureaucratic garbage which as I said, is designed to fulfill some need other than the immediate requirements of the job, which is where I struggle.

So anyway, just to finish my history. I went to middle school until I left in the 7th grade when I dropped out and became homeschooled again, which didn't actually entail much official schooling. I mostly just educated myself on stuff I happened to be interested in. My parents knew I couldn't take public school anymore. I went to a community college during the time that I was finishing up my homeschooling time. It took me over five years but eventually I got a associates degree and in college I suffered from all the same problems I laid out before. But I did get the degree. It's useless for me however.

So, I'm now in a situation where I've kind of accepted that I can't get a job. If I were to go to an interview, I'd be far too awkward and unable to follow the instructions during the interview, both in preparation for it and in terms of answering the questions during it. Secondly, if I did ever get a job somehow, I'd be fired within a couple weeks as soon as the employers see that I can't perform. My parents have been understanding to some degree and have supported me up until now, but our financial situation is much tighter now and I really want to try and help out, even though I know I can't.

I would say that the only job I could really get would be some kind of job where the boss tells you exactly what to do and there's no reading between the lines whatsoever. For example, the boss says ""take this shovel and move these rocks from this pile into that pile."" I can do that, but even with manual labor, a lot of it is too difficult for me to interpret what they're asking me to do. Does anyone have any advice on what I should try to do? I basically just want some kind of manual labor job (not dissing manual labor at all here, just to be clear) where I don't really have to engage in deep thought about what's going on. I was thinking maybe some kind of assembly line job could be possible. I really want to try and find something here, but I don't really think there's a specific job that allows for simple manual labor like that. Do such jobs exist, and if so, what sort of titles would they be under and how might I apply for it? I I just wonder what happens to people like me sometimes. I mean what if I can't get any kind of job? I live in the US and we have basically no welfare state whatsoever. Especially since I've never had a job, they won't give me anything. I guess I'm just gonna be homeless, but I think I might have missed some kind of opportunity in the form of a simple, manual labor job that doesn't require previous experience in carpentry or construction or anything like that, and that doesn't require any of the thinking on your feet that I'm so bad at. I really appreciate any advice.",1585070305.0,2020-03-24 13:18:25,March
630,630,Who’s making 50K+ working from home? I NEED YOU.,135,fiq1l5,careerguidance,https://www.reddit.com/r/careerguidance/comments/fiq1l5/whos_making_50k_working_from_home_i_need_you/,67,"Hi Redditors!

Okay, it’s official: I am completely fed up with my current job and I am ready to make the switch to working from home. 
I’m a 23F with 3 1/2 years of sales experiences. I have some college, but no degree or certifications. I currently make around 50K a year right now, and that’s the only reason why I stay. I honestly don’t know where to start looking or the best way to make this transition. 
If anyone here is living my dream, and making 50K+ from home I would love your advice and guidance on how I can be in the same position.  Hopefully the right person sees this, and can deliver me from my current job woes.
Thanks!",1584250700.0,2020-03-15 01:38:20,March
631,631,Is there a career out there that would suit someone who enjoys in-depth research and who also likes tracking things?,133,fgba57,careerguidance,https://www.reddit.com/r/careerguidance/comments/fgba57/is_there_a_career_out_there_that_would_suit/,83,"I'm addicted to information: I love reading about new topics and exploring them in-depth. I like reading through scientific papers on topics to see what the evidence-based studies say. I often have like 30 tabs open on Chrome at the same time, most of which are interesting things I'm reading about or watching.

I also like to track things. I regularly update my Excel personal budget and I've previously tracked stuff like calories, steps, weights lifted at the gym.

The last thing I really enjoy doing is writing. I am good at explaining technical concepts to a non-technical audience. 

I have a degree in a math/stats discipline.

Is there any career that could in some way combine these three interests? The first thing that came to mind was a data analyst but I would appreciate some other suggestions. When I picture myself as a data analyst, I don't feel much excitement and I think a modicum of fire in the belly should be a prerequisite to pursue any career. 

Thanks for any advice.",1583862180.0,2020-03-10 13:43:00,March
644,644,Which IT job has the highest earning and job prospect out of the three ahead of me?,132,fqsj0u,careerguidance,https://www.reddit.com/r/careerguidance/comments/fqsj0u/which_it_job_has_the_highest_earning_and_job/,45,"I’m looking for guidance from seasoned IT professionals about the career paths ahead of me. 

I got laid off due to COVID and I’m wondering how to best prepare for the post COVID opportunities. I have time now to sharpen some skills.

Background:
Bachelors in Economics
Masters in International Relations 

I got dragged into the tech world a few years ago (after several years of completely unrelated experience).

During the period of employment, I started working more and more in tech related roles. It was a start up and so I wore several different hats. 

Here is a rough breakdown of responsibilities:

- 5% QA (writing test cases, assigning tickets, creating QA timelines)

- 15% Product management (wireframe, get client requirements, talk and design with engineers)

- 30% operations (writing SQL queries - Oracle/SQL server, building tableau dashboards) 

- 30% data analytics (creating segments, data cleaning, regressions - mostly in Excel, R)

- 20% random stuff 

Questions:

1)Out of these, which do you believe has a higher earning potential over time?

Data Analyst 

Product management/BA

Operations Analyst 

2)How important is it to get IT qualifications / certificates to be employed by larger companies? Since my formal education is unrelated to IT, I feel like my resume may be over looked.",1585458260.0,2020-03-29 01:04:20,March
702,702,I graduate HS in June and don’t know what I want to do. Can I have some advice?,121,fbjrqd,careerguidance,https://www.reddit.com/r/careerguidance/comments/fbjrqd/i_graduate_hs_in_june_and_dont_know_what_i_want/,101,"I’m 18 and a senior in high school and quite frankly life after high schools terrifies me.
I’ve already decided I’m not going to college. I can’t stand school, I literally stare at the clock for half the day. Combine this with the fact that I’m just not that bright of a person on must subjects. I’m an average student grade wise (B’s and C’s with A’s in those easy electives).
I’ve never really had a set career that I’ve wanted to pursue. I’m really interested in aviation but I just suck at math and anything science or physics related.
I also tend to be kind of anti-social. I like being alone and private when I’m not in school or at my part time cashier job at a local grocery store. I don’t get invited to the typical high school parties and the such.
I’m kind of lost and need some help. Thanks!",1583042051.0,2020-03-01 00:54:11,March
717,717,"Proposed salary cut by 20% due to COVID19, what do I do?",118,frozly,careerguidance,https://www.reddit.com/r/careerguidance/comments/frozly/proposed_salary_cut_by_20_due_to_covid19_what_do/,36,"Location: Australia
Industry: Manufacturing
Employees: 450+

Today all employees at my workplace were issued a letter stating our hours are going to be cut back by 20% (work 4 days as opposed to 5). We are required to sign and send back acceptance of the proposal in the next two days.

Is this legal?

The individual contract I signed at the start of my employment states I'm on a salary with a regular working week of 38 hours.

I am in a finance position and I know sales have not been impacted to the extent that measures like this need to be put in place. Maybe the board is just taking precautions, but I can't help but feel they are using the whole coronavirus saga as a cover to cut labour costs for the foreseeable future.

I'd like to hear your opinions on the matter. Thanks in advance for the feedback.

EDIT: through my research I can conclude it comes down to the wording of the letter your company provides. If it's a request or proposal to change your hours - totally legal. You can decline to sign and then face whatever repercussions come of that. If the company does not give you an option and adjusts your salaried hours without consent - not legal and you can take the case further if you wish. 

I hope this helps anyone that's in the same situation.",1585596138.0,2020-03-30 15:22:18,March
745,745,"My job is NOT what I signed up for, do I continue to voice my concern to my boss or do I take a different approach and start looking for other work?",114,ffo6lw,careerguidance,https://www.reddit.com/r/careerguidance/comments/ffo6lw/my_job_is_not_what_i_signed_up_for_do_i_continue/,36,"Some quick background information - I recently graduated from my second undergraduate degree in Finance. For approximately 7 months, I  have been working in a Business Analyst (BA) role for a utilities company and have previous held the same role position for a financial institute (as work experience for my degree).  I have a general idea of the career as I'm currently educating myself in the evenings so I can start my CPA designation as I see myself in an analysis/accounting role. The job market where I currently live is not the greatest so I applied for basically every entry level analyst job I could find and took the first one I could get (for financial reasons, I needed money and I needed it fast).

Here's the thing - I'm an entry level employee and I'm interested in finding a job where I can learn both  from hands on experience and mentoring, but I understand I have to keep my head down and do the mundane ""chore"" tasks that get assigned to me. Anyways, when I interviewed for the role, I made sure to ask questions about mentorship, where my duties would be focused, areas for growth and potential opportunities to learn, etc. The job was laid out to be an analysis role focused on process improvement and documenting, data gathering, interpretation and modelling. Unfortunately, outside the process modelling, I don't do much of the work mentioned above. 

To make matters worse:

1. There is a huge internal company project going on that limits the amount of money that is spent on projects outside of this initiative - basically new work is not exactly going to happen for the next 2-3 years because of this. 

2. My department is split into two teams: the BAs and the Operational Support team (OS). There is a massive growth plan for the support team because the need for the technology support is growing much faster than the team right now - which makes my role feel even more insignificant.

3. My manager has spoken to me about how my role will be shifting to accommodate the support team and I will likely be acting as a tool for them to use when they need to create/model processes or documentation. 

4. My current projects involve developing internal contests (which we are now not going to run), maintaining a website, documenting communication strategies, creating bi-weekly presentations for a stand-up meeting, other small one-off mundane tasks and supporting a technology upgrade (this one actually makes sense and fits scope).

I have voiced my concern, and my manager essentially responded with training will likely be through hands-on only, and your role will be shifting to more of a support role. I don't want to seem ungrateful because I'm lucky to have a job but I have slim to no mentorship, little support from my manager, and it is turning into a completely different job than I interviewed for. 

As you may have guessed, the culture is not the greatest either but that's beside the point. I feel like I'm stuck in a job where I'm learning near nothing, I feel underappreciated and I'm truly worried for my long-term career. I'm young and looking for opportunities to grow, learn and build a career so I'm a little scared I'm heading into the wrong direction and something needs to be done (I just don't know what).

Anyways, I don't mean to sound like I'm complaining, I just feel stuck. I'm just hoping to get anyone's advice on this or personal experience with something similar. Do I continue to voice my concerns or is there something better for me to do? Maybe it's at that point where I aggressively apply to new jobs and quit the one I'm in once I find a new one?

I really appreciate it, thank you to any responses in advance!",1583751826.0,2020-03-09 07:03:46,March
837,837,What Certification Programs for Jobs that pay up $50K a year?,94,ffr0x5,careerguidance,https://www.reddit.com/r/careerguidance/comments/ffr0x5/what_certification_programs_for_jobs_that_pay_up/,72,"I'm looking to get into a certification program or trade school that will take anywhere from a few weeks to a year to complete.  I have done the college thing before, and decided that it's not for me.",1583767554.0,2020-03-09 11:25:54,March
857,857,"Start working remote, could you give me some advice?",95,ffjy6v,careerguidance,https://www.reddit.com/r/careerguidance/comments/ffjy6v/start_working_remote_could_you_give_me_some_advice/,24,"Hi guys, I am thinking to start working remote for a new company but I am afraid of not being able to spend some time with other people and clear my head up. In my previous companies, I was always on-site, and while this meant for me to commute for almost an hour, I ended up having great professional relationships in and out of the office. Doing coffee breaks, team lunches, etc. Now I fear that this will no longer be the case as everything will be remote. Does this feeling happen to you as well? How do you connect with people working remotely too? Any platform or suggestion?",1583733510.0,2020-03-09 01:58:30,March
918,918,What corporate job will be busy and needed through the aftershock recession?,83,fmij5p,careerguidance,https://www.reddit.com/r/careerguidance/comments/fmij5p/what_corporate_job_will_be_busy_and_needed/,48,.,1584840313.0,2020-03-21 21:25:13,March
919,919,Has anyone moved on from a career you wanted really badly because nothing ever worked out no matter what you tried?,82,fk4o66,careerguidance,https://www.reddit.com/r/careerguidance/comments/fk4o66/has_anyone_moved_on_from_a_career_you_wanted/,26,"I chose a career in the medical field because I truly love studying the human body and wellness. Problem is I’ve been so miserable that after completing school and failing to get a job in my sector I turned to research in a corporate setting. I’m treated very well at my current job and I get just about everything I ever want but could not get from healthcare (respect, opportunity for advancement, and mentorship). Honestly I could not handle the bullying and I broke down at the end of my schooling but managed to graduate on time. Has anyone experienced this? How did you continue trying or just move on?

*If I could get in to my field my earning power would go up drastically and I could work for myself after a few years of learning everything. I acknowledge that I would probably be miserable but at least I could do want I want after a while.
*At this point I’ve don’t two years of clinical research at two different universities and neither wanted me or advocated for me. In contrast I started my current position in August and I’ve already received a raise and bonus, pay for private leadership coaching, and they’re going bananas because I’m willing to learn how to model/code their health related data.",1584478123.0,2020-03-17 16:48:43,March
920,920,Starting over at 44: am I doomed?,87,fbugg8,careerguidance,https://www.reddit.com/r/careerguidance/comments/fbugg8/starting_over_at_44_am_i_doomed/,13,"So I'll be 44 this year, and I've been disabled throughout my adolescence and for all my adult life. I was diagnosed with autism at 42, and with ADHD at 43. Since entering treatment, my health has improved dramatically, and I'm now in a position to work towards things that I thought could only be dreams.

This poses a bit of a problem, since I have no idea what I want to do - or rather, I desperately wanted to study a language and then translate, but my home situation makes that difficult. I know that I want to go to university, but I have to decide what to study once I'm there, and what sort of work I not only want to do, but *will be able* to do. I'm educated to UK A-level standard, and am doing preparatory college courses to get me to the point I'm confident in my ability to tackle a degree.

I'm focused, driven and meticulous. I'm a problem-solver. I love data and detail. I love complex structures. I love puzzling out difficult things. I love going deep into one small field for years. I argue a lot, and I write well. I read very fast, and I'm a good researcher. I read Acts of Parliament and draw graphs for fun. I like numbers and logic. I do basic coding in around ten languages, and I use this constantly to fix problems around me. I do Japanese fan translations. ***I'm a learner*** - I love to study. Even at my worst, I've always worked to be better.

But I also have serious issues around my health. I can't do hard physical labour. I can't work routine long hours. I can work with people, but I'd need longer periods of working by myself. I put myself across well in writing, but in speech I come across as confused and inarticulate; I don't deal well with people. I have issues with memory and attention that make me prone to constant errors. I don't want to spend too much time in front of a computer, because it detaches me from the world that I need to be *in*, if I'm ever to accomplish anything in any job. I'd like to be able to work from home some of the time, but not all of the time.

I know I want to get a degree, just because it rankles that I've been to uni twice and don't have one. But I'm afraid that I'll take the risks, lose a lot, and still be unemployable at the end of it. I'll be in my 50s by the time I'm looking for work, an age when most people are terrified of losing their jobs because they'll never be rehired. And I don't know what my disability issues will look like in five years. I hope many will improve, but I would be a fool to think that many won't.

Am I fooling myself to think I can start out in a profession in my 50s, with no work history? Are there even careers for people like me?",1583100269.0,2020-03-01 17:04:29,March
927,927,"I lost my job because of Coronavirus, What should I do now?",86,fjsira,careerguidance,https://www.reddit.com/r/careerguidance/comments/fjsira/i_lost_my_job_because_of_coronavirus_what_should/,28,"What’s up everyone, I recently got laid off from my electrical job as a helper.Work was slowing down because no one wants us in there houses or offices. My company is looking to lay off a couple more because of it. I worked there for 8 months and now I’m looking to go into a different career field, any suggestions? Is right now a good time to look for a job? I still got bills to pay so I need to find something for the mean time. I’m 18 btw 
Thank you!",1584421957.0,2020-03-17 01:12:37,March
