,index,title,score,id,subreddit,url,num_comments,body,created,date_created,month
939,939,"Graduated college almost 3 years ago, but I haven't gotten into my field yet. Did I miss the boat? Am I still competitive?",85,g2mm4n,careerguidance,https://www.reddit.com/r/careerguidance/comments/g2mm4n/graduated_college_almost_3_years_ago_but_i_havent/,26,"Hey, Gurus. In June 2017 I graduated from the University of Washington with a BS in Information Technology. In the months after I sent out lots of applications, but never made any headway; a lot of denials, a handful of interviews, and even 3 precious last-round interviews, but I never managed to seal the deal with anything. Now nearly three years later, I'm wondering if it's too late. Can I still compete in today's market with an aging degree? Can I leverage my 7 years of customer service experience and 5 years of leadership roles in my favor? Should I just suck it up and live the Walgreen's life? Any advice on the matter would be so so appreciated. Thank you all in advance.",1587096706.0,2020-04-17 00:11:46,April
949,949,What jobs can I get with a Masters in History?,83,fzqkyc,careerguidance,https://www.reddit.com/r/careerguidance/comments/fzqkyc/what_jobs_can_i_get_with_a_masters_in_history/,81,"Hello everyone,

I'm 29 years old with a Masters degree in History and a Post-Graduate Certificate in Digital Curation.  In spite of this, I am having a lot of trouble with landing a job.  In the past I have applied to entry-level positions in museums and libraries, very rarely have I been interviewed for any of the positions I've applied for, and when I do get an interview, somehow I mess it up.

I could use a lot of help.  While I would love to be able to work in an archive/library/research setting, I feel incapable of finding that job.  Given the amount of rejections, it is more and more difficult to be positive about my chances of finding a job in this field.  I was wondering if anyone here had some advice for me about getting a job in information services.  I'm also open to suggestions for alternative career paths.  Thank you.",1586696925.0,2020-04-12 09:08:45,April
987,987,My company is cutting salaries by 20%...but I can’t afford the pay cut. Is there a way to negotiate this diplomatically?,78,g6v3s6,careerguidance,https://www.reddit.com/r/careerguidance/comments/g6v3s6/my_company_is_cutting_salaries_by_20but_i_cant/,41,"I am a sr. associate level employee working for a small-ish company. A few weeks ago, it was mentioned that executives and director-level employees may be forced to take a pay cut to keep the company afloat. However, today it was announced that all employees will see a 20% pay cut starting in a few weeks.

I am currently one of the lowest paid employees in the company and absolutely will not be able to afford the cost of living in my area if my salary is reduced by 20%. I met with my boss to ask whether the exec team could consider a lower percentage cut (like 10 or 15%) for employees making below a certain salary/seniority level. The company is small, so there are only a handful of associate level employees to whom this exception would apply. He was pretty negative towards the idea saying that it’s “tough for everyone right now” and that it’s “only fair” for everyone to make the same sacrifice.

But the thing is... we’re not really all making the same sacrifice. While I am grateful to have a job during this situation, a 20% cut for my boss and other senior level employees is probably a “sacrifice.” On the other hand, a 20% reduction for those of us at the bottom is a make or break difference. Honestly, when the office reopens, Im not even sure if I’d be able to afford the cost of my commute anymore on this reduced salary. It would almost have been better to be laid off or furloughed because currently, unemployment pays more than my reduced salary, plus, I’d be eligible for other benefits, like food stamps and subsidized rent. At the very least, offering a reduction in hours along side the salary decrease would allow me the ability to take on a second job (if I can find one...)

My boss told me I could bring it up with HR, but that they “most likely won’t be receptive.” I understand that things are tough and I am willing to sacrifice in order to keep my job (such as giving up other benefits like the paid leave I’ve acquired) ... but I need to at least try to negotiate a better situation because, quite frankly, I can’t afford not to.

Is there a way for me to go about this diplomatically?",1587705298.0,2020-04-24 01:14:58,April
