,index,title,score,id,subreddit,url,num_comments,body,created,date_created,month
12,12,Anyone feel depressed after being on LinkedIn?,772,fellu7,careerguidance,https://www.reddit.com/r/careerguidance/comments/fellu7/anyone_feel_depressed_after_being_on_linkedin/,151,"I've often felt mildly depressed after being on LinkedIn.  Not sure why.

Anyone else feel that way?",1583563101.0,2020-03-07 01:38:21,March
16,16,Did Covid-19 put a halt on your job search ? Join the club.,712,fi7zfr,careerguidance,https://www.reddit.com/r/careerguidance/comments/fi7zfr/did_covid19_put_a_halt_on_your_job_search_join/,179,"Right before the mass hysteria happened, I had just completed a preliminary video interview for this media/entertainment company.  I was calm, cool and collected. Took my time and practiced so I was confident throughout the process. They said I would hear the results back in 1-3 weeks. However, I did not expect a global pandemic to be going on at the same time as well lol. I still feel very confident and optimistic about it. It just sucks that this pandemic happened at the WRONG time. I want to reach out to the recruiter who contacted me but I don’t even know if there office is closed or not. The job is located in NYC and I feel like it could be another month before I hear back about the results. Has the Covid-19 interrupted anyone else on their job search ? We are in this together.",1584166734.0,2020-03-14 02:18:54,March
17,17,"Interviewer berated me because of a misspelled word on my resume, they were incorrect. How should I have handled this situation?",704,fk80ka,careerguidance,https://www.reddit.com/r/careerguidance/comments/fk80ka/interviewer_berated_me_because_of_a_misspelled/,160,"The allegedly misspelled word was 'Licence'. In America, and possible other countries that use American English, the word is spelled 'License'; in Canada and the UK, it is not. 

On my resume I have a section near the end that lists a few licences and certifications I have. The interview was for a very large engineering company that gave me the interview after a recommendation I received, so I assume they only glanced at the resume before giving me a call.

The interview itself was supposed to be an hour, but it only lasted around 45 minutes. I was being interviewed by a man, Joe, and a woman, Jane. Near the beginning of the interview Joe points something out on my resume to Jane and smirks, I knew the area of my resume he was looking at and assumed it was to do with a cert I have that doesn't formally expire so the formatting is weird.

The interview went really well, but it all fell apart at the end when we were wrapping up, Joe said ""just one last question, how do you not proofread a resume?"". He followed it up with a comment about how it otherwise looked great and I obviously put time into it, but this typo was jarring. I asked what typo and he just pointed at 'Licence'; my reaction was shock and a stunned silence before I said ""that's how you spell that"". Which he didn't like. He chuckled at my comment and sounded really annoyed when he just spat out that no, it wasn't. I didn't know what to say so I doubled down and he got very annoyed / angry and became pretty condescending. He started lecturing me about how he was trying to help me, how I obviously wouldn't be getting this job but in the future I should just focus on my spelling and not to attack interviewers. We started to argue and bicker over it and it was getting heated when he told me to leave. I said check your drivers licence and tell me how it's spelled there but he wouldn't. He just ended the interview on that note. While I packed my things and put my coat on, Jane checked, and told Joe that it's spelled licence there. I had already mentioned that 'License' is the american english way, but he didn't seem to know what i meant.

How should I handle that in the future, or should i just take the word of my resume?",1584490749.0,2020-03-17 20:19:09,March
18,18,Anyone else get annoyed with Linkden? (Rant),698,fscato,careerguidance,https://www.reddit.com/r/careerguidance/comments/fscato/anyone_else_get_annoyed_with_linkden_rant/,170,"It's a great resource for finding jobs and networking, but it seems so fake to me. 

Example: someone posts something like - Today, my salary was reduced by half my pay, and based on where we are with COVID, I was not upset. I pushed my team, blah, blah, blah. Such BULLSHIT, right?! No one is okay with making less. 

Example2: someone worked 6 months at a role which they had no experience in prior - generated this, consulted that, and managed 200,000 whatever, whatever, fake! 

It just seems like such a fake place to try and make yourself look good. It's adult show and tell about their careers, which is fine, but so many 'fakish' profiles and douchebags. 

In a way, it's maybe upsetting because I'm more humble and will post simple - 4 years at x company working in x area managing x, y & z. 

Thoughts? Maybe I'm the douchebag.",1585687646.0,2020-03-31 16:47:26,March
35,35,Has the COVID-19 response delayed anyone else’s career path?,557,fnio5n,careerguidance,https://www.reddit.com/r/careerguidance/comments/fnio5n/has_the_covid19_response_delayed_anyone_elses/,264,"I know there have been a billion posts all over Reddit about COVID-19 since this started, but I was wondering if anyone else was in a similar situation as myself. To give context, I’ve been in a career for a few months now that I’m not sure I truly want to stick with forever. I wanted to find some job shadow opportunities in my area to help me try other things and guide me towards a decision to get out of my current career or not. However, all the programs and opportunities I found in my area have been cancelled or suspended due to the Coronavirus crisis, making me stuck in place for now. This is frustrating to say the least, and I want to know if the stupid Coronavirus has crapped all over anyone else’s career plans.",1584993055.0,2020-03-23 15:50:55,March
55,55,I was rejected from a position that required a high school diploma when I have a bachelor's. How am I supposed to properly handle how pathetic I feel right now?,452,fitp9r,careerguidance,https://www.reddit.com/r/careerguidance/comments/fitp9r/i_was_rejected_from_a_position_that_required_a/,457,"There was a lab job I applied for that only required a high school diploma and practically no experience was required. Being that I have a bachelor's degree and some lab experience, I figured I might have a shot. Turns out my application was about as worthless as a used candy wrapper.

I was sent a rejection email within a few days saying how I wasn't a ""good fit"" and how they decided to move on with another candidate (probably the hiring manager's friend/family member). I feel like absolute garbage right now. Even jobs with the most basic requirements don't want anything to do with me. I keep getting told to stay positive and keep tricking through, but how am I supposed to keep going when I have all of these rejections and failures punching me in the stomach and kicking me while I'm down.

I hate job hunting so much. The whole process is stupid and I wish it wouldn't be so stressful. I feel incredibly pathetic and I don't know what to do about it.",1584265482.0,2020-03-15 05:44:42,March
77,77,Why do employers and candidates play these little charades during the interview/hiring process?,406,fdv05c,careerguidance,https://www.reddit.com/r/careerguidance/comments/fdv05c/why_do_employers_and_candidates_play_these_little/,142,"I am a recent graduate looking for a job and it bothers me to no end that employers seem to come up with the most ridiculous things to do/ questions to answer for applicants during the hiring process. Tests that can be faked or you later find out don't attribute to the hiring decision. Questions you can just lie about to get in their good graces. Questions employers know everyone is going to answer the same anyway even if it is not true. 

""Now Mr.Smith, this is a prestigous position (it is not but whatever), so we are only looking for people who are hard workers. Are you a hard worker?"" -\_- .....

I mean, seriously what they hell is this? Why do employers do this? Can somebody please explain this? Also if this is some kind of jedi mind trick voodoo bullsh\*t HR people learn during the education can somebody point me to the resource teaching them this because atleast then I can put my mind at rest again.

Thanks in advance, and apologies for the saltiness of my post.",1583442474.0,2020-03-05 16:07:54,March
80,80,Is it normal to just not know what you want to do?,396,fciqie,careerguidance,https://www.reddit.com/r/careerguidance/comments/fciqie/is_it_normal_to_just_not_know_what_you_want_to_do/,104,"Is it normal to just not know what you want to do? 

&#x200B;

So much of my career is based on impulse. I have a general sense of where I want to go, but lots of anxiety about where I don't. Most people seem to be set in their career, they want to be an actor, doctor, lawyer, here I am - a rift raft in the water, not sure what to do, where to go, and unsure of myself.   


I mean, is this a normal feeling to not know what you're doing half the time?",1583211041.0,2020-03-02 23:50:41,March
85,85,31M. Lost my job due to corona virus quarantine and my market is completely crippled. What is my next career move?,389,fo71hl,careerguidance,https://www.reddit.com/r/careerguidance/comments/fo71hl/31m_lost_my_job_due_to_corona_virus_quarantine/,76,"I was a bartender for 6 years, and due to corona virus being a widespread pandemic, all of the restaurants in my city have been shut down until further notice. Many of my friends have been offered their jobs back once the ban has been lifted, but my establishment has informed us they will not be reopening. I have been thinking for some time now of getting out of the restaurant business, and figure this is perfect timing for a career change. I have no idea what to consider moving to right now, and was wondering if any of you have been in a similar position and had to make a similar transition? I have a high school diploma, and have been working in the food industry my entire adult life. I have been looking at different job majors and online courses during this quarantine as well. Any advice would help!",1585092769.0,2020-03-24 19:32:49,March
90,90,What USEFUL online certifications can I start working towards in this period?,383,fq951r,careerguidance,https://www.reddit.com/r/careerguidance/comments/fq951r/what_useful_online_certifications_can_i_start/,97,"Since there’s nothing to do at home due to this pandemic, what USEFUL certifications can I start working towards? 

KEYWORDS: USEFUL, sellable, employer-worthy

Also, I’m open to any career path",1585382642.0,2020-03-28 04:04:02,March
93,93,How do I play out my final two weeks when my supervisor and coworkers are taking my resignation personally?,373,fgu3un,careerguidance,https://www.reddit.com/r/careerguidance/comments/fgu3un/how_do_i_play_out_my_final_two_weeks_when_my/,83,"I have been working with the same company for the past 2 1/2 years. Some of us were part of a major company initiative, and there is a strong since of camaraderie amongst those who were part of it and are still with the company. As a result of my strong work performance and the respect I share with my peers, my boss pegged me as the ""point person"" for my department - which involves setting guidelines and training new employees within my wing of the operation.

*You can imagine their surprise when I put in my two-week notice a few days ago.*

Despite the good vibes mentioned earlier, I had not received a raise or promotion since I started. I met with my boss and supervisor several times, and was told the earliest they could promote me or give me a raise was in 6-7 months from now. I recently took an interview with another company, and offered the promotion and raise I was looking for. I accepted it because it's what's best for my career.

Since my boss and my direct supervisor were both out of the office on the day I received the offer and my start date with the new company is soon, I e-mailed them a professional note announcing my resignation effective in two weeks and thanking them for their support during my time with them. My coworkers' reaction upon finding out from my boss and supervisor have been all over the map.

My supervisor, who I shared a good relationship with, didn't talk to me for three days. When he finally met with me behind closed doors, he berated me for leaving - though also asked if there is any counteroffer the company could make after saying I 'burned a bridge' with him, which was sort of a weird 180. A couple of other coworkers who are part of the ""camaraderie"" still haven't spoken to me. My boss, though he understands my decision, was not shy about mentioning the staffing woes the department is now in (we were understaffed even before I put in notice). On the contrary, one superior  who I thought would be indifferent has become my biggest supporter, wishing me the best and saying the company played itself by not promoting me when they should have.

**My question: how do you play out the remainder of your two-week notice when a handful of your coworkers are taking your professional decision personally?**",1583945473.0,2020-03-11 12:51:13,March
105,105,Do others around the age of 30 struggle with career direction?,356,frbgyf,careerguidance,https://www.reddit.com/r/careerguidance/comments/frbgyf/do_others_around_the_age_of_30_struggle_with/,80,"I am approaching 30. Work in sales and  have done for just shy of a year, before that I was in a financial  brokerage for a year, and an investment bank for a year. Graduated in Business Management in the UK, on a 4 year with a placement.

The  thing is and this has been the case for all my life and probably is for  many - there's just not something I am so passionate about that I want  to invest all my time specialising in. I left finance because I actually  hated the environment, the people. It was so toxic at one point I  resigned from my brokerage and luckily landed a job in tech sales. It's  now been just shy of a year and there's always so much pressure with  targets and aside from COVID for one moment, your job is under threat  after a period of time if you don't keep up with the numbers.

As  I approach 30, I have come to realise that life ISN'T worth this kind  of stress. And yet I'm earning £50k GBP which is in terms of averages,  pretty decent going for a 29 year old. But it's somehow not important to  me. If anything, it's easy to compare to some of my younger friends who  are in banking and earn even more than that and will continue to earn  more and more. I find myself looking up and thinking I should be doing  better, rather than looking down at say retail workers who earn 20k for  example. Heck, I'm talking to a Brazilian lady on a dating app who is 35  and works in a retail store as well as a restaurant receptionist - I  suddenly look much better than her. It's easy to forget.

But  I think I would be happier if you told me that I found my  girlfriend/wife to be, and was earning 20k, rather than earning say 50k  as I am and being single. There's just nothing that makes me think life  is worth repeating day in day out just to pay a mortgage, retire, and  then die. It just feels so unimportant. I guess I was never lucky enough  to discover my 'passion' from a young age and implement it into my  work. I'm into football but don't want any job around that other than be  a professional football player, which I am not.

I  recently started to look into coding and weigh up whether this would be  worth my time. It's actually interesting, but reading between the lines  it seems that it's going to be very challenging finding work in this  area without a degree, notto mention take years to learn enough to be  job ready.

I just feel kind of  lost and always have done with 'work'. Like there's never been an  underlying purpose/motivation behind it. Anyone else having career blues  around a similar age?",1585538377.0,2020-03-29 23:19:37,March
110,110,"Late bloomers who became successful, what's the best advice you can give to people just starting out?",349,fge0dt,careerguidance,https://www.reddit.com/r/careerguidance/comments/fge0dt/late_bloomers_who_became_successful_whats_the/,171,"I'm 24, I don't have a degree yet, and I'm only recently applying for jobs. I'm starting college online in a few months after I start working. Still trying to figure out if I should pick Finance or Marketing as my major. 

Thanks to anyone who replies. Hope you guys have a great day.",1583876630.0,2020-03-10 17:43:50,March
121,121,"""We've decided not to fill this position at this time."" Has anyone been getting these emails more frequently given the whole coronavirus situation?",337,flnj8x,careerguidance,https://www.reddit.com/r/careerguidance/comments/flnj8x/weve_decided_not_to_fill_this_position_at_this/,102,"Today I got an email from a position I applied for and as soon as I saw it I thought ""Of course, ANOTHER rejection where they tell me I'm not a good fit."" I was shocked when that wasn't the case. Instead I was greeted with an email stating that the hiring manager decided not to fill the position at this time.

I'm wondering if given the whole situation with the coronavirus that this is happening more often. I know it's possible I could have gotten this even if it weren't happening right now, but I know tons of places are struggling and are currently experiencing hiring freezes. Has anyone else been getting these type of emails recently?",1584702200.0,2020-03-20 07:03:20,March
149,149,Wtf do people do for a living where they can buy houses and range rovers?,309,fbp7fx,careerguidance,https://www.reddit.com/r/careerguidance/comments/fbp7fx/wtf_do_people_do_for_a_living_where_they_can_buy/,203,"I’m 26, and I don’t know what I want to do for a career. I’ve had over 25 jobs (mostly pertaining to event staffing and restaurants). Ive also moved a dozen times to different cities. As you can see I have a really hard time “sticking” to things, mostly fueled by the curiosity of “what else is out there” 
I’ve been back and forth school, changed majors like 6 times. I usually do something math/science oriented but find a reason to stop going like “i can’t get a job in that field” or “it’s boring.” I get straight A’s and I’m a hard worker and I’ve made some decent tips but I’m just ready to make a real salary. I don’t understand what it takes, where to start, how to find something I can do. I live in an area where houses are $1 million dollars and I just don’t get how so many people can afford it and it frustrates me. I’m afraid of shifting around BS jobs for years to come and having nothing to show for it. Please help me figure out what to do. I’m currently in trade school for electrical but I’m not sure if the field is right for me either.

Edit: THANK YOU everyone who responded. Your advice is indispensable and I definitely gained a better understanding of how to succeed. I’ll stick with trade school and root myself in that field. Thanks again :-)",1583067392.0,2020-03-01 07:56:32,March
154,154,Fired for insubordination. How to handle conversation in future interviews?,303,fmhnfc,careerguidance,https://www.reddit.com/r/careerguidance/comments/fmhnfc/fired_for_insubordination_how_to_handle/,56,"Hello Career Guidance,

I was fired 2 weeks ago due to insubordination regarding holding my team accountable to the attendance policy. Senior Management told all managers to write up their hourly teams if they called in during the COVID-19 outbreak, and long story short I had my team disregard that. I just got called by our HRBP saying  that I was marked as unrehirable.  How should I handle this conversation when it pops up in interviews? Thanks for any advice.",1584837070.0,2020-03-21 20:31:10,March
200,200,Is it bad that I want to be laid off now that my job security is up in the air?,278,fpeu7g,careerguidance,https://www.reddit.com/r/careerguidance/comments/fpeu7g/is_it_bad_that_i_want_to_be_laid_off_now_that_my/,85,"I was told yesterday that my job is on thin ice. Up until then, I had motivation to work my hardest for the company. Now I just feel let down. 

I’m in my early twenties, live with my parents, and I am honestly content with collecting unemployment. The “will they/won’t they lay me off” thing is simply too much added stress for me. Am I right to WANT to be laid off, so I can collect unemployment in the short term?

This may seem like an insane question...",1585269987.0,2020-03-26 20:46:27,March
218,218,Finding a job during the coronoavirus outbreak?,267,fkpo07,careerguidance,https://www.reddit.com/r/careerguidance/comments/fkpo07/finding_a_job_during_the_coronoavirus_outbreak/,148," 

I'm curious as to what career opportunities that are available during the coronavirus pandemic that allow one to work from home? I'm afraid my opportunities are limited to only having a highschool diploma/cosmetology license, however I know there are people with more extensive qualifications, so all options are accepted under this post!

Thank you for any recommendations!",1584567608.0,2020-03-18 17:40:08,March
246,246,I’m settled into my job - and I think everyone forgot about me?,259,fdc2qi,careerguidance,https://www.reddit.com/r/careerguidance/comments/fdc2qi/im_settled_into_my_job_and_i_think_everyone/,63,"Hey, all. I work at a large manufacturing company, where I am the marketing director. I’m 6 months in, and our growth is through the roof. I’m cranking out projects left and right and our digital presence went from non-existent to very strong in just months. Yet, no one really cares. Like, at all. Never a “good job”, never anything insinuating they value me whatsoever. I don’t get any negative feedback either - just nothing. 

I’m the only person in the entire company who works alone (not on a team), so I want to stay connected to my boss. She routinely blows off our weekly meeting without reason and never reaches back out to apologize, let alone reschedule. Lately, she doesn’t even answer my emails. It makes me feel...stupid? Like my work isn’t that important to her. I honestly think I’m being forgotten about. 

I don’t hate my job, but being in a busy work environment and feeling isolated really sucks. I want to stick it out for at least 2 years, but I’m concerned this is going to stunt my career growth as I’m not learning anything from anyone, other than my own research.",1583352591.0,2020-03-04 15:09:51,March
251,251,Am I going to bartend until I'm dead?,250,fdoffi,careerguidance,https://www.reddit.com/r/careerguidance/comments/fdoffi/am_i_going_to_bartend_until_im_dead/,177,"There isn't a job I want to do. If I didn't have to work I wouldn't. I have never gotten any satisfaction from working, I have simply done it to keep a roof over my head.  I think this is how I fell into bartending in the first place.

I moved across the country at 20 years old (2008 by the way) and realized ""Life is hard when you're the one paying for it""  
Ended up in a bartending job because it was a way to make enough money to pay my bills and have some money left over for the actual enjoyable part of life.

Fast forward 11 years (31 now) and I'm still bartending. Where I'm working pays really well but I swear I'm dying on the inside. 

The problem is that I genuinely don't know how else to make a living out here. I live in CA and I can not reasonably afford to rent a place of my own (51% of my income just to cover the $1700 rent for a studio or maybe 1 bedroom if you're lucky) *with* my good paying bar job, so what else is there?

Am I missing something? Nothing really calls to me for a job, so is this it? Do I just bartend so that I have something to make an income off of for the rest of my life and just kinda die inside? There's no job that's calling to me. Hobbies and passions sure, but they require money to do anyway and you don't get paid to do them. Not as inexperienced as I am either.

&#x200B;

I don't know, it feels like life is really hollow and I don't see a way around it. Have you been here before?  Am I missing something? I'm so tired inside",1583404592.0,2020-03-05 05:36:32,March
275,275,What to do when you don't want to work?,242,fp1p2h,careerguidance,https://www.reddit.com/r/careerguidance/comments/fp1p2h/what_to_do_when_you_dont_want_to_work/,183,"I currently have a bachelor's degree and a stable office job, but... 

I don't wanna work. Don't wanna have a schedule.
Don't wanna create things of great use to society.
Don't want to be financially dependent on my parents also. Don't want to live on the streets. Don't wanna be an intern in a monk place. Too uncharismatic and shy to be a social influencer. Bruh",1585211339.0,2020-03-26 04:28:59,March
