,index,title,score,id,subreddit,url,num_comments,body,created,date_created,month
227,227,"Hardly anyone speaks to me at work and I’m having difficulty connecting with my team. What am I doing wrong? Does anyone have suggestions on how to interact with coworkers, especially when you’re one of the youngest in the company?",266,g1tclo,careerguidance,https://www.reddit.com/r/careerguidance/comments/g1tclo/hardly_anyone_speaks_to_me_at_work_and_im_having/,109,"EDIT: I just want to sincerely thank everyone for their comments and advice. It’s been super helpful and insightful—it’s so easy to get bogged down by my own personal feelings and not consider the perspective of others. I have a lot to consider: how to balance my true self and my work self, proving I’m a good worker, and thinking about if I am a fit long term in this current position or with the company.  I may not get to all your answers and advice but just know it’s appreciated!

—————
I just started a new job a couple of months ago and I’m having a hard time fitting in. It’s my first job out of school in a large company in the Midwest (USA) and I moved here from a North Carolina suburb. I am one of the youngest here. 

I’m a very outgoing person and was very excited to come to this position. I love learning about new people as well. I met with all kinds of people, introduced myself, asked them tons of questions, and tried my best to start conversations. 

But that’s not reciprocated. I often don’t get told good morning (I get no one OWES me this but it’s a bummer), I get ignored in meetings, and no one wants to hold a conversation with me about even the most mundane things. My emails get ignored sometimes too even by those within my function. For the email thing, I probably need to earn my place or something, but it’s compounded by all the other things I’ve been experiencing. 

A couple of examples:

My function had a group call and I asked them what they’ve had for breakfast just to fill the pre-meeting silence and got nothing back. Another person came on and they were willing to talk to them about their mundane question. So I didn’t bother saying anything else and it has made me stop going into meetings too early. 

I went to a team building lunch and no one spoke to me despite me asking them questions about themselves and trying to connect on what they’re talking about. At a table of four, I sat with two other new people and one seasoned employee. One new person asked everyone but me what brought them to the company. I asked her but no one reciprocated. Things like that happened throughout the lunch. I just stopped talking.

It’s honestly made me withdraw into myself and kind of killed my desire to be outgoing. I feel very alone and that no one really wants me there or wants to get to know me. I just sit in these meetings, introduce myself and people say “hi” and nothing else. So I’ve kind of stopped trying.

I know it’s important to be strong and hold out, especially in new positions, but I thrive off of team work and some sort of camraderie. 

It’s probably hard to gauge just from a post on reddit but any suggestions on how I can connect with my team and business partners? What sort of things am I doing wrong? What can I do to improve? Maybe I’m just reading into it incorrectly. I don’t know. I honestly feel like maybe the Midwest isn’t for me...",1586990970.0,2020-04-15 18:49:30,April
257,257,I got offered a new job which means I’m going to have to resign from my current role while in isolation. How should I approach this?,246,g12i7z,careerguidance,https://www.reddit.com/r/careerguidance/comments/g12i7z/i_got_offered_a_new_job_which_means_im_going_to/,61,"Before we went into isolation, I was interviewing for another role and had my last interview around about the same time most businesses converted to working from home. 

They then called me to say that there’s a recruitment freeze and it would probably be a while before I’d hear back from them. 

I was relieved about this as my current employer has been really good to me throughout this whole isolation process and I didn’t want to have to resign during this time.

I received a call today to say that I basically had the position (pending reference checks) as the CEO of their company called off the recruitment freeze. 

I’m super happy about this as it’s exactly what I wanted before isolation began - the role is way more pay, in an industry im passionate about and close to home - but now I’m in an awkward position where I’m probably going to have to resign via email or zoom from my current employer. 

I’m having a lot of anxiety about resigning due to the fact my current employer has treated me really well, they’ve ensured my job security throughout lockdown and also it’s a ‘cushy’ job. 

But I also really want this other position and I won’t be able to wait it out until the end of lockdown to take it as I doubt it would still be available.

What is the best way for me to approach this? 

Ahhhh help 😢",1586885646.0,2020-04-14 13:34:06,April
278,278,"If your 30+, did you change career in your young 30s and how did it go?",238,g3qeyd,careerguidance,https://www.reddit.com/r/careerguidance/comments/g3qeyd/if_your_30_did_you_change_career_in_your_young/,93,"A little bit about me...

I’m 32 and had a stroke November last year, which took away my speech. I had to relearn how to speak starting with the abc. Today marks five months since my stoke and I have recovered roughly 75%. I still find it difficult to get out some complex words, joining words (like ‘and’ and ‘an’), and my sentences sometimes have slight gaps between words. Sometimes I speak perfectly, but I’m slower than I once was but I’m getting there! They say it’s takes several months to a year to heal the brain after a stoke. I’m have youth on my side. 

Before I had my stroke, I was travelling the world for six months. I got made redundant in March 2019 from my finance role, where I analysed companies (shares) and the economy for a living for six years writing a newsletter for a global publishing company. All up I have roughly 7-8 year experience in the financial industry. But I wasn’t able to break into a big fund or broking firm, so I was severely underpaid (~$80k) by industry standards of $150k+. But I have the interesting and competitive experience for finance, I guess.

My concern is that I have over a years gap on my CV....now with the corona virus and businesses not advertising for jobs. Then again, if this event didn’t happen, I still wouldn’t feel ready because of my speech - it will be hard to sell myself now. I’m thinking of giving myself until the end of the year to hopefully recover, and, by then hopefully the economy will be reopened and companies hiring again. 

To cut a long story short, I’ll probably be out of the work force for nearly 2 years because of my stroke and the economic shutdown before I apply to jobs...if I start applying at the start of next year. 

I have always wanted to give tech sales a crack, but that depends obviously on my speech and how much it recovers - I’ll need to sell myself to land a job and I can only do that if I’m 99% better. I feel hopeful about it though. But I don’t know what I will look like in 3-6 months. If not, I will probably go back into finance becuase I’ll have no choice. That said, I’m just concerned about my possible 2 year gap. 

Do you think I’m screwed and have anyone changed careers in their 30s, or got a professional job with a long gap on their CV?",1587256511.0,2020-04-18 20:35:11,April
295,295,How can I make my boss understand how overworked I am?,233,fvy2vt,careerguidance,https://www.reddit.com/r/careerguidance/comments/fvy2vt/how_can_i_make_my_boss_understand_how_overworked/,72,"Basically, I'm the team lead and in charge of supervising two junior team members, so I have all of their responsibilities plus a heap of other responsibilities on top of them - including managing those team members. Despite this, I've been repeatedly chewed out by my boss because the junior team members complete more of a few specific kind of tasks than I do in a shift.

To me this seems ridiculous. It's like asking a manager of a coffee shop why they aren't making as many cups of coffee as the baristas. During shifts I'm the sole go-to person for people from other departments (there's a lot of back and forth) and in charge of overseeing operations, and deciding which tasks are priorities and which aren't, and doing final QC checks. Even to get all of that done I usually end up working 10-12 hour days, and it's still not enough.

My boss just won't listen when I explain how overworked I am. He has very specific ideas about how long certain tasks ""should"" take, right down to the second. He's mapped out my shifts according to these increments of time that he's decided constitute how long each task should take and it all adds up to 8 hours, therefore he thinks there shouldn't be a problem. There's no accounting for the fact that switching tasks every few minutes makes a dent in focus and productivity.

For example, one of the tasks that he's tacked onto my job is running social media. I'm supposed to post to Twitter 30 times a day with accompanying images, gifs etc. and he says that this should be easy because ""it only takes a few seconds."" But crafting a tweet that's witty and engaging and corporate-friendly takes more than just a few seconds, and interrupting my day to do it 30 times is really disruptive.

With everything that I'm expected to do, mistakes are inevitably made and things slip through the cracks. I've been reprimanded for mistakes many times and every single time I tell him the same thing: I have too much stuff to do. And nothing changes. If anything, more work just gets added to the list.

Has anyone had any success getting through to a hard-headed boss? So far I've tried everything that I can think of.",1586205844.0,2020-04-06 16:44:04,April
303,303,Why do recruiters think it's acceptable to be so aggressive?,227,fx9mcz,careerguidance,https://www.reddit.com/r/careerguidance/comments/fx9mcz/why_do_recruiters_think_its_acceptable_to_be_so/,65," I recently made my resume visible again on a popular job search site. Almost instantaneously, I was inundated with calls, emails, and even texts from recruiters. Some would use all three methods, one right after the other. In addition, a large percentage of these recruiters would call my phone not once, but twice in a row, and some of them even called THREE times in a row. When I’d send them to voicemail, they’d just call right back a second later.

This kind of behavior is ridiculous. There is no better way to drive candidates away than to inundate them like this. In addition, I'm getting multiple recruiters contacting me for the exact same job - I'm talking upwards of 10 different recruiting companies trying to fill the same position. I can't imagine that a company would enlist 10 separate recruiting companies to fill one position, that just doesn't add up to me.",1586392169.0,2020-04-08 20:29:29,April
343,343,I sold my soul to the film industry at 18 and finally have the means to get out. What should I do with my life?,209,g695t4,careerguidance,https://www.reddit.com/r/careerguidance/comments/g695t4/i_sold_my_soul_to_the_film_industry_at_18_and/,79,"Hi I'm 28yo Canadian and have worked in the film industry since high school starting as a production assistant and moving up. My job has been my whole life. The money is good but I work soooo much. I work an extreme amount - 80 hours a week. Sometimes I have weeks with no work and sometimes I work 10 months in a row non-stop. 

My mental health is suffering now that I'm older -- I can't sustain this lifestyle, I want different things, some free time and money doesn't matter as much. I would be happy 40-50k a year. My personality type is INTP if that helps.

I want to...

work in an office setting, good job prospects, courses that are less than 1 year and cost less than 10k to complete.

I have no bachelors degree or any skills outside of my industry. I am very hard-working and feel like I'm capable of a lot. I don't even have any interests outside my industry that would be applicable to other careers... :( 

Do not want to go into healthcare or trades. 

Options I am thinking of:

PCP (payroll certificate in Canada) -Has anyone done this? Getting a job doing payroll --again don't know if I can get hired without having an HR or Accounting designation. 

Programming -- Don't know where to start here, I am thinking of learning a language (Python) or going to a coding bootcamp oe doing a udemy course. 

Feel overwhelmed with the choices and don't know if learning programming languages but having no formal computer science education will let me get a job. 

Please suggest me anything!",1587617499.0,2020-04-23 00:51:39,April
352,352,Is it in poor taste to quit a job I just started to accept a better offer?,207,g9bgc8,careerguidance,https://www.reddit.com/r/careerguidance/comments/g9bgc8/is_it_in_poor_taste_to_quit_a_job_i_just_started/,67,"I accepted a job last week, and tomorrow will be my first day. Another company I have been interviewing with contacted me today to complete a background check, and on their online portal it says ""offered"". I don't have an official offer, but I believe one is contingent on my background check. It is higher pay, better benefits, and more aligned with my career goals. 

I would just quit my first offer, but I am worried the background check won't go through. I am mostly concerned because my last job was an unpaid volunteer internship. HR at my previous internship won't be able to verify my ""employment"". Only me previous manager. Do you think this will make me fail the background check? HireRight didn't have me fill in any employment information, but I imagine they are getting that information from my resume or job application. 

So currently my plan is to go to my first day tomorrow, and continue working the first job until I potentially get an offer from the second place. I'm hoping it will be a week or less. Or, should I just call and tell them I decided to accept another offer? I feel bad wasting their time, but I'm worried I won't really get an offer from the better company. 

I really need advice.",1588057019.0,2020-04-28 02:56:59,April
364,364,How realistic is a career in programming from being self-taught?,200,fzw90g,careerguidance,https://www.reddit.com/r/careerguidance/comments/fzw90g/how_realistic_is_a_career_in_programming_from/,120,"Live in UK.

- Early 20s.
- Have no qualifications.
- Left education at 16 to work for family business but want to move on.
- Never been smart, no special talents or anything.

And I want to teach myself code. Am I kidding myself?

I do have an interest but have no experience. I have a whole year off work to get started.

Please be brutally honest.
Very much considering joining the army if all falls apart so there's that.

Edit: Genuinely staggered by all these replies, thank you! Heaps of information, so glad I asked this here.

Going to get straight to it then. Success or not, might as well give it my best shot. Cheers!",1586724898.0,2020-04-12 16:54:58,April
366,366,"I don't want to work for the corporate world, how do I fulfill this?",200,fwnzp5,careerguidance,https://www.reddit.com/r/careerguidance/comments/fwnzp5/i_dont_want_to_work_for_the_corporate_world_how/,104,"Sorry if this is jumbled and a lot to read.

I'm a 22 year old male from the USA about to graduate with a degree in Software Engineering (Computer Science) in 2021. I had an internship and honestly it was the perfect job for someone going into my field, it was fun, exciting, and hands on.

I just don't feel any type of reward from working hourly paid jobs, maybe because I don't feel the direct impact of what I am doing, plus I hate belonging to a big group.

I noticed I am much more productive when I'm not following other peoples orders. For example, over the breaks I would sometimes do unassigned projects on my own, then when the next semester would start a professor would assign something similar and I would end up procrastinating and barely submit it on time while I had already completed something similar. I also work as a freelance mobile mechanic and do heavy research on the vehicles that I fix and I have a lot of enjoyment working on their cars.

In my life I had worked 12 different jobs (construction, software internships, mechanic engineering internships, Retail, etc.) and I would always think cynical thoughts to cripple the companies.

I'm currently deciding whether to just graduate and finish my degree in Software Engineering, then apply for dental school and eventually open my own practice.

My dream in life is to work less than half the year in the States, and spend the rest of the year in a Latin American country with the money I saved up working in the USA. Basically make 40k in 6 months then live in Central America for the other 6 and repeat this process.

edit: Latin American country for example would be a Guatemala or an Ecuador, something less developed, than some of the more booming markets.",1586307259.0,2020-04-07 20:54:19,April
392,392,I’m doing a bad job because I suddenly got sick. I’m terrified it will ruin my career. How can I ask for help when I’ve only been in the job so briefly?,194,g6r0gy,careerguidance,https://www.reddit.com/r/careerguidance/comments/g6r0gy/im_doing_a_bad_job_because_i_suddenly_got_sick_im/,59,"I have an autoimmune hyperthyroid disorder that has greatly affected me the past two months. Medication is no longer working and I’m doing very poorly at work. 

Most days my heart rate is 105 -130. I’m confused a lot, anxious, and distracted. I cannot think critically, organize my thoughts, or do the analytics I need to be successful in this job, no matter how I try. I’m lucky my workload is light at this time due to the current COVID situation.  I hope to have surgery to remove my thyroid in June but in the mean time, I’m stuck like this

This job is high level and if I fuck it up, the industry is small and I’m not sure if my reputation would recover. I just started my job in January and had my disease go haywire in February. Quitting is not an option due to health insurance and a relocation repayment agreement of $20k.

At the interview, I presented as a smart and capable person. Now I feel I can barely think of words to say. I feel 100% incapable of making good recommendations and business decisions. It took me a full day to comprehend and complete a simple task. I have chest pains and unexplained anxiety daily. It’s serious and I feel my reputation is tarnished if I don’t get time to get better. 

I’m exploring my options for leave but I’m terrified of the repercussions. How can I speak to my boss? I’m terrified of being fired in the COVID-19 environment and being left without health insurance. It would potentially ruin my career as well. Should I speak to HR first?",1587692127.0,2020-04-23 21:35:27,April
399,399,Is there even a point to searching for a job right now?,189,fwwakk,careerguidance,https://www.reddit.com/r/careerguidance/comments/fwwakk/is_there_even_a_point_to_searching_for_a_job/,122,"Is there even a point to searching for a job right now?  

We are in crisis and our governor is telling us to stay home....    The state is locked down and I am laid off... 

&#x200B;

In a normal lay off, I would find a new job in a few weeks. This is different.


Edit: 
Primary field: advertising
Related fields: marketing / advertising / media 
Job experience: project manager",1586334902.0,2020-04-08 04:35:02,April
400,400,Taking a Pay Cut for Coronavirus... Should I Do It?,190,ftbemf,careerguidance,https://www.reddit.com/r/careerguidance/comments/ftbemf/taking_a_pay_cut_for_coronavirus_should_i_do_it/,58,"Update: thank you everyone for all of your sage advice! I’ve decided to take the cut and start working on my network and resume. I’m very grateful to even have a job during this time and need to remember that as I go forward! 

I make $52k a year in a big city and just barely get by as I help out my mom financially. Half of my small company was laid off in the past few weeks and now I've been asked to join the rest of the company in taking a 10% pay cut for an entire year (April 1, 2020 - April 1 2021). In return, they're giving me 5 extra vacation days, which hurts because how could I afford a vacation on less pay?

I've spoken with my friend in HR there and know for a fact that everyone else makes at least $20k more than she and I do, so asking the only 2 people who make less money to also take a cut makes me so angry. Granted, I'm extremely fortunate to have a job still in this climate. 

I've been told I can keep my current pay and forgo my extra vacation days but the people I've spoken to have said I shouldn't expect to keep my job if I do that. I'm terrified of losing my job but I can't imagine spending an entire year making so little money. Any advice on how you would handle this?",1585813292.0,2020-04-02 03:41:32,April
441,441,"I’m not very good at my job, and I’m failing. How do I get out with my reputation intact?",178,g8zhcy,careerguidance,https://www.reddit.com/r/careerguidance/comments/g8zhcy/im_not_very_good_at_my_job_and_im_failing_how_do/,45,"So basically I’m working as a social media manager, one day a week. I was hired because I’ve successfully managed a very large group that contained the brands target audience. I also successfully manage the page of a personal project of mine, and was part of Facebook’s community leaders programme. 

I had been working previously in politics in a communications role after graduating in 2018. The politics contract was very high level but it was only to cover a maternity leave, but it was a great opportunity at my stage in my career and I came out of it with my reputation enhanced. It was not a social media job, and was mainly geared towards traditional media.

I’m hoping to get back into the world of politics and communications full time, but in the meantime I was offered to take on this job. I wanted to make sure my CV didn’t lie empty in between jobs, the extra cash was of course appreciated and thought I’d be good at it. I thought wrong. 

I can’t stand my boss, I think the brand I’m working for is toxic, for example we were forced to turn off reviews. But anyway I’m three months in and realise that the Coronavirus has wrecked profits for the brand, and my social media posts aren’t reaching acceptable levels. We have a following of around 5000, and the reach of our posts is around 180. 

The money I get paid isn’t very much, but I’m afraid that I’ll get sacked, or I’ll quit and it’ll put off future employers. I don’t think the agency I’m working for would provide glowing references. 

So basically do I quit or hold out? Wipe it off my CV and just not mention it, or just leave it up and hope for the best? It’s been a big misstep and I wish I hadn’t done it.",1588018031.0,2020-04-27 16:07:11,April
478,478,How to choose a career?,170,fz8i3l,careerguidance,https://www.reddit.com/r/careerguidance/comments/fz8i3l/how_to_choose_a_career/,60,"Hi. I'm 25 years old and have never known what I want to do. I completed a course in IT back in 2016 but haven't been motivated to do anything with it since.

I've been working in a restaurant for the past few years and I do somewhat enjoy it, but its not something I want to be doing for much longer as I hate the anti-social working hours, the pay is only just above minimum wage and there's not much in terms of progression.

My parents are always trying to convince me to go back to education but I'm reluctant simply because I don't know what I would do and I don't want to end up wasting a whole load of time and money on something I may not like.

So does anyone on here know of any tips on deciding what to pursue?

Thanks",1586650420.0,2020-04-11 20:13:40,April
