,index,title,score,id,subreddit,url,num_comments,body,created,date_created,month
482,482,"Should I (25f) take the easy route and study library science, or the exciting, difficult route and try forensic science?",169,g9zfyn,careerguidance,https://www.reddit.com/r/careerguidance/comments/g9zfyn/should_i_25f_take_the_easy_route_and_study/,95,"**EDIT: WOW thank you for all your responses, everyone ;\_; I can't reply to all of you but there's some great advice in there. I really appreciate it. <3**

My BA (East Asian Language and Lit) has gotten me nowhere other than high-end retail, and at this point I feel like I need a graduate degree in order to progress. I certainly don't mind going back to school, but I'm not sure what I even want to do.

My top two choices are a) library science or b) forensic science.

Library science makes sense as it gels with my educational background and previous internship experience as a librarian and a teacher. The work would be easy, it'd be cheaper than other degrees, and it would only last two years. It's also an easy program to get into.

The problem is that I just don't... really... want to be a librarian. I don't feel any passion for librarianship. It feels like the easiest, most mundane choice I could possibly make, and I hate that. It would be stable. It would be smart. It would be very boring.

On the other hand, there's forensic science.

Pursuing forensic science wouldn't make sense, but it's my dream career. I am deeply fascinated by everything to do with forensic science and have been since I was a child. I read forensic news and research in my spare time (which I've had a lot of lately). However, it would be a complete 180 from any of the work I've done so far. I didn't take any STEM in college, I have no background in chemistry. Is this even plausible? Is there any way I could catch up??? I'm a quick learner and I absorb information fast; is there somewhere I could start?

These things might not even matter, however, as my choices are limited by my college transcript. To be blunt: it sucks. Nearly everything from freshman to junior year is a total garbage fire with a few Bs thrown in for variety. My main problem was that I was too busy sleeping and staring at walls to go to class; the second problem was the suicidal depression. When I did make it to class, I would sleep at my desk and take notes that were mostly nonsense scrawling.

Eventually I got diagnosed with narcolepsy, took a year off, came back a little more manageable. My senior year is all As. However, a college board probably isn't going to care about any of that. Any respectable program would take one look at my awful GPA and toss my application in the garbage. I also won't have any stellar letters of recommendation from professors, because, well, I was asleep, and a very bad student.

Sorry this is so disorganized. I don't know what to do or where to even begin. Which program should I choose? Should I even try???? Any advice is appreciated.",1588149647.0,2020-04-29 04:40:47,April
501,501,Not rehired as a teacher- what else can I do?,162,g4veli,careerguidance,https://www.reddit.com/r/careerguidance/comments/g4veli/not_rehired_as_a_teacher_what_else_can_i_do/,63,"Crossposting for more help.

 Throwaway so it cannot be linked with my other account.

I am a chemistry and physics teacher, and I was not rehired for next year. I do not want to be a teacher any longer. I am wondering what else I can possibly do? I have taught for 10 years, have a BS in biology and a MT in education. I am lost, I was just told like five minutes ago via video conference and... Help?",1587427145.0,2020-04-20 19:59:05,April
512,512,I’m on furlough and I want to move to a different city where I’ve always wanted to settle and ask if I could work remotely when I’m called back to work. Should I go for it?,162,g1hlb2,careerguidance,https://www.reddit.com/r/careerguidance/comments/g1hlb2/im_on_furlough_and_i_want_to_move_to_a_different/,26,"The timeline of the furlough is unknown, and it’s not guaranteed to get the job back.",1586939940.0,2020-04-15 04:39:00,April
530,530,Should I make a LinkedIn post about my acceptance into a big city gallery (&link to it)... even if my work in it is technically NSFW?,157,fwb25i,careerguidance,https://www.reddit.com/r/careerguidance/comments/fwb25i/should_i_make_a_linkedin_post_about_my_acceptance/,17,"Looking for advice on a potential LinkedIn post

I’m trying to post more on LinkedIn. Recently, my photography work got accepted into a gallery in a big city in my state—a big deal for me. Because of the current COVID-19 situation, the gallery ended up being online. I wanted to make a post on LinkedIn about it, but the catch is that my photo is technically NSFW (you can see a very very small portion of an areola in it of my female model). There are other photos in the gallery that are also technically NSFW, but it’s kind of the nature of the beast aka it happens in art a lot. Neither my photo nor the other ones I have seen are sexual in nature. 
I’ve shown my boss and my coworker the photo and they thought it was amazing, they weren’t offended by it. But then again, for context, photography is my hobby, it’s also not directly my day job. I’m a tech writer, and I sometimes photograph products, but that’s it when it comes to my pro photography work. On the flip side, I was in a previous gallery before for my photography work, and that previous gallery I did post about on LinkedIn. 

Anyways, should I post about this on LinkedIn with the link to the gallery? Or do I skip this one out and just reference that I was featured in it on my page somewhere.",1586250471.0,2020-04-07 05:07:51,April
540,540,"We're being taken advantage of at work, what should we do?",154,gawh2f,careerguidance,https://www.reddit.com/r/careerguidance/comments/gawh2f/were_being_taken_advantage_of_at_work_what_should/,53,"I've worked at a company that's been going downhill for the last few years. It was a toxic work environment, and there was a lack of work even before this ongoing economic crisis happened. I was laid off a few weeks ago, and ended up receiving much more through unemployment due to the recent CARES act than I ever did working full-time. **A few weeks ago, I recieved a call from an HR assistant sounding like they were reading a script:**

""Hi is this (name)? I'm calling from (company name) to let you know you're rehired. 

We've had problems with others not answering us, so we called from a separate number to increase the chances you'd pick up. You are unable to reject an offer of employment without losing your benefits. If your performance is unsatisfactory during the time we're rehiring you, you will be fired, and you'll receive no benefits.

We've received a loan which is contingent on rehiring our old staff. We acknowledge most you are now making more money from unemployment, but we won't be matching it. We want to inform you that the loan only covers the next few months, and we'll likely have to lay you off again when the loan runs out, so please make necessary arrangements. Unfortunately, this would also be when the additional unemployment benefits from the CARES Act goes away, so you wouldn't be receiving any extra money than either unless new laws are passed."" 

Everyone is upset about this, the feeling is that we were tricked into working for a worse version of unemployment, and we have no leverage. Our supervisor continues to talk about bringing *more* people back, despite the lack of work. It's not a tradeoff of financial aid for job security for most people, and I've been extremely stressed.

Do you have any advice for me, or suggestions on what you'd do in this situation?",1588285009.0,2020-04-30 18:16:49,April
555,555,The biggest career transition in all of history?,152,g44t58,careerguidance,https://www.reddit.com/r/careerguidance/comments/g44t58/the_biggest_career_transition_in_all_of_history/,62,"Hi Career folks,

I just watched an interview on post Covid19 world and the expert they had on made a statement which perked me up. 

He stated that 'when things recover, many people had time to think about what they want to do - many people will decide not to return to what they were doing before. This is going to be the biggest career transition in all of history'.

I am somewhat doubtful with this statement, however it does apply to my situation. I have been planning and working towards a career change well before covid situation. Now I am even in more hurry to move into a different field.

What are your thoughts? Do you foresee many people jumping ship? are you planning to returning to your old post if still available?

**Source:** COVID: Metamorphoses | Google’s top-rated futurist on post-coronavirus world | SophieCo. Visionaries",1587316972.0,2020-04-19 13:22:52,April
600,600,"How do I approach a lead whose ""jokes"" about me messing up/being unproductive are starting to wear on me and make it worse?",143,g2gi0t,careerguidance,https://www.reddit.com/r/careerguidance/comments/g2gi0t/how_do_i_approach_a_lead_whose_jokes_about_me/,29,"Ever since my coworkers and I started working from home about a month ago, I've had a really hard time staying focused. I have been diagnosed with ADHD by several different doctors, but my psychiatrist refuse to medicate or discuss other behavioral options with me because I don't think she believes the diagnosis/thinks I'm just ""on my phone too much""... So I've relied really strongly on the external structure of a workplace environment and co-workers around to keep me focused. Since that doesn't exist anymore, I'm falling apart. I'm making more mistakes, being less productive, pretty much a slew of fireable mistakes if I wasn't working in an industry that doesn't really fire people.

One of the leads I do occasional work for has always needled me, and I could probably write an entirely separate advice post about his other behavior towards me. However lately, he's started making jokes about my mistakes... Saying things like ""you messed up... again? :)"" on a daily basis. I can take a joke, but the same one made every day when I *am* trying to find ways to create structure and stay focused is really wearing on me. 

It's already upsetting to be letting people down constantly, I want to do a good job and it's humiliating. But the jabs are getting to me and obviously making it worse, as I'm posting on Reddit instead of working. How do I get him to stop? (Other than not screwing up...which I'm working on...)",1587078017.0,2020-04-16 19:00:17,April
611,611,"I'm 21, and I'm making the best money I've ever made... but I don't think I want to do this job forever. What are my options?",143,fxvmba,careerguidance,https://www.reddit.com/r/careerguidance/comments/fxvmba/im_21_and_im_making_the_best_money_ive_ever_made/,45,"I just started working with a commercial roofing company a few months ago at entry-level, and it pays the best I've ever made by far. However, I'm already beginning to feel as though I don't want to stay doing this forever, because I'm beginning to resent the fact that I never know when I'll be home, and I fear that there isn't much room for me to grow because I don't know if I'm ever going to be suited for a position where I am in charge of other people. I'm thinking of going back to school (I finished high school but that's it), partly to seek career growth but also because I feel I am bored and mentally understimulated. I'm not sure what to go back for though, and it's a difficult situation to try and go back because I need to work full time to support myself and my fiancee (her mental health struggles have been a barrier to her working up to this point, I am our sole income). I'd like to have a career that's more intellectually interesting, but I'd like a more stable schedule (roughly 40 hours most weeks, preferably). I have a bit of a STEM background from the advanced program I went through in high school, and think I might be interested in a career in biology or botany, but I am open to other fields of study, and I do enjoy being outdoors, but it seems that any outdoor job tends to have a more unpredictable schedule and/or less pay than I would prefer. What do y'all think, is it worth my while to explore other options, or should I just get over myself and stay where I'm at?

Edit: I'm located in Saukville, WI",1586478858.0,2020-04-09 20:34:18,April
624,624,"What kind of jobs can you do from home, not having to interact with people, that pay at least $50,000 a year?",141,fxnv4k,careerguidance,https://www.reddit.com/r/careerguidance/comments/fxnv4k/what_kind_of_jobs_can_you_do_from_home_not_having/,193,"I asked this in the jobs subreddit, and the mod removed it saying “No soliciting”, even though I’m not trying to sell anything, so, I guess I’ll post this here, since it’s essentially the same thing (career=job).

And preferably not require 8 hours a day, or 40 hours a week, but I wouldn’t be unwilling to spend that much time since the benefit would be getting to be at home by myself.

Disclaimer, I’m 24, but a social anomaly, and my family’s abuse and being financially unable to support myself makes me socially withdrawal even more.

I’m kind of relieved school has been moved online (because of the pandemic that mentioning gets people banned and demonetized in the case of YouTubers) because socially, I was getting nowhere.

I’m a college freshman at 24 years old, who sucks at driving (recently failed the test) and completely dependent on my parents to not be homeless. 

I couldn’t even get the pills I require to function on a basic level if it weren’t for being on my parent’s health insurance (I live in the United States, no Universal Healthcare here), which I will be legally forced off when I turn 26. If I lost access I could literally end up another crazy homeless person, and no offense to anyone (I know some really are just down on their luck) but I would rather kill myself than be homeless (also because I’ve already been abused and miserable my whole life)

I suffer from OCD, ADD, and more recently, severe anxiety, depression, and until my psychiatrist added another medication, near-violent rage (I can’t function at all without medication, and I’m still not a functional adult).

I hate my job, but I am very grateful to have it (especially throughout the whole pandemic, because many people have lost their jobs) and virtually always go in, no matter how bad I feel, because I know that being unemployed is 100x worse.

I literally just bag groceries, get grocery carts from a parking lot, and restock returned items. Sad part is, I started in a regular department, where I was even initially told that I was doing good, then that quickly turned into me being “too slow” and “missing too many details”.

I do not want any handouts, even if I am legally entitled, I’m already ashamed enough, and relying on others to survive is a TERRIBLE feeling, the fact that I rely on my own parents makes it somewhat more bearable, but I still get let know that I’m “past my time”, sure, I contribute to some things, but that’s such a small percentage of full living costs, my parents work very hard (I know life is hard, one of my biggest mistakes was growing up believing life was easy and just happened by itself).

I had internet friends, but withdrew myself because it felt pointless talking to people I’d never see. I also swore off LDRs, because I’d never get to see any of those girls/women in real life, even if I could, I can’t afford actual living costs, and even if she’s one of those women who takes care of her man (nothing wrong with that if it’s ok for a man to take care of a woman) I don’t want my livelihood dependent on anybody but myself.

If I have a girlfriend and we break up, I at least shouldn’t have to worry about being broke or homeless.

I’m willing to work, but it eats me up inside everyday, doing a job that nobody actually needs done (or at least takes virtually no skill to do whatsoever), having people treating me like I’m slow (stop calling me buddy unless you’re Canadian!) automatically seeing my job position, and feeling unworthy of any social interaction, if I befriended anyone, it wouldn’t be long before the questions start about my lifestyle, and I will be judged, negatively.

I have too many mental issues, emotional, even physical (some may or may not be caused from medication), and now I’m plagued with insecurity, and despite desperately wanting to break dependence on my family, lack of motivation to do anything.

OK, I do have motivation and interests, they’re just not very strong or consistent, nothing is really THAT INTERESTING, if it is, the interest won’t last long, until it’s just another memory that’s no longer associated with pleasure.

Other reasons working from home would be nice, more dependent on myself (well, if I’m self-employed, which would be true financial freedom, or at least as close to possible as it), less forced socializing means more energy, less anxiety (I’ve literally resisted a panic attack to run out of the building, although that was the first day of a job, and it was better as soon as the second day, although it was seasonal and they let me go after the season), and hell, this whole pandemic is reason enough to work from home if possible. 

I was never meant to be a social extrovert, if I can have any social and/or dating life, I don’t want it to be too much. 

It’s hard to feel any worth or value from doing work that you don’t feel purpose from, especially when you have nothing else, or nobody else, to live for outside of a job. 

Even if I don’t have to be a complete social hermit (I’ve come so close to becoming a complete misanthropist due to how I’m treated, and resisted falling into the cult of inceldom and misogyny, when I manage to avoid hatred, my perspective just leaves me with confusion) it’d still be nice to be able to work from home, and make not driving even easier (that’s caused so many issues for me, and I’ve spent so much on Uber and now risking catch the you know what, and some mentally unstable guy almost drove into incoming traffic with me as a rider!)

*Sigh*

Even when I’m told how much I’m appreciated and how good a job I do, I feel like worthless garbage, because that’s not a real accomplishment for somebody my age, I should have a REAL ADULT JOB and be living on my own, supporting myself.

I’m not worried about supporting a family (why the hell would I want to create kids against their will who could suffer just like I have? That’s assuming any woman even wanted to do that with me) but feel I need to make a lot of money just for myself, for freedom, because true freedom only exists with a lot of money. I’ve never felt free, yet my family claims that “Democrat socialists” will take our freedom away, especially because “socialism is the first step leading to communism”. 

Well ONE, I think America needs a better social safety net and PROGRESSION (we should strive to be like Denmark, the happiest nation on Earth, me may have a much bigger country, but we also have more wealth to cover it) and TWO, I’ve never felt freedom anyway.

The closest I ever got to freedom almost left me homeless, that hurt my sense of competence even more. Being told I’m stupid for trying doesn’t feel like freedom, and being stranded from running out of savings certainly doesn’t feel like freedom.

I was told to try and change my situation if I was so miserable, and when I tried just that, my family told me how wrong it was and that I needed to go back to sitting at home, and I ran out of savings from motel rooms and applying to basic jobs, ending up staying with other family and relying on government assistance just to eat!

I WANT MY OWN LIFE! AND I WANT TO PROVIDE IT FOR MYSELF! 

I am so different than most people, and it’s only getting worse....",1586445302.0,2020-04-09 11:15:02,April
652,652,How transparent should I be after being terminated?,133,g7j9e5,careerguidance,https://www.reddit.com/r/careerguidance/comments/g7j9e5/how_transparent_should_i_be_after_being_terminated/,38,"I was abruptly let go from my employer for violating their time reporting policy. My project job leader wasn't pleased with the verdict as this could've been a teachable moment for my benefit where a warning would've sufficed. Nevertheless, he has offered to be a strong reference for me, and I'm grateful that I have that support. I dwell and feel genuine regret over this anomalous incident, but I recognize that it's made me a better person.

Moving forward, my questions are:

* How transparent should I be to my professional network in regards to finding my next role? 
* What are recommended job search strategies, particularly during the pandemic?
* Tips on evading inquiries from ex-coworkers, family members, or friends  when it's still a sensitive matter for me to share?
* Should I be transparent to a recruiter when they ask why I left the organization or wait until the interview with the hiring manager? 

Crossposted in r/Unemployed , r/jobs , r/careeradvice

Edit: Addressing some questions, this was my first job out of grad school, it was my first offense and a misunderstanding on my part with no monetary benefit or expectations of being paid more as dictated by the company’s compensation policies.",1587800372.0,2020-04-25 03:39:32,April
661,661,Is it possible to get a good job with a DUI?,131,g7aouy,careerguidance,https://www.reddit.com/r/careerguidance/comments/g7aouy/is_it_possible_to_get_a_good_job_with_a_dui/,80,"I was pulled over for a DUI almost a year ago. It wasnt intentional, I woke up from sleeping and drove, since then I decided to quit drinking.  I'm wanting to join an apprentice as an electrician, plumber, or HVAC tech, I  have a small side business as a handyman now. My question is, is it even worth considering because no one will hire someone with a DUI in that industry, or should I go fulltime as a handyman when I move down south and work for myself. I'm 29 and looking for a new career path. Thanks!",1587771967.0,2020-04-24 19:46:07,April
670,670,22F College Graduate and I still can’t find a job?,128,fvag56,careerguidance,https://www.reddit.com/r/careerguidance/comments/fvag56/22f_college_graduate_and_i_still_cant_find_a_job/,58,"
I’ve been really depressed after graduating from UC San Diego last June 2019. It’s been months and months of constant rejection. I’ve only get offered jobs from minimum wage jobs such as Target. I graduated with a bachelors in science in public health. I’m starting to realize my degree gets me no where. However, a few of my peers with the same degree has found a job related to health. I also have been applying to internships, yet I never get called to set up an interview. I have previous work experience at an office and I have plenty of volunteer experience. None of these has led me to any job entry positions. Am I doing something wrong? Is it my Resume? The way I type information onto online applications. My lack of skills? My degree? I’m just deeply depressed and I even moved back home in Northern California with my parents and they’re financially supporting me. This makes me feel completely guilty as I’m the first to graduate and I can’t get a job anywhere. Not even the public health department at different state counties will offer me an interview.

I’ve been super down and all of that sadness comes from moving back home with my parents, not having any friends at my hometown, and no money. 

Advice?",1586103572.0,2020-04-05 12:19:32,April
901,901,Why am I being told no?,88,fvq29f,careerguidance,https://www.reddit.com/r/careerguidance/comments/fvq29f/why_am_i_being_told_no/,56,"Four interviews since 1/20 and all have said no.  I am so confused. I look up questions and practice them. I show up early and I dress nice. I do a follow up if a week goes by. 


Two gave me feedback. They both said I did good and would be eligible for future hire but that another candidate fit the position better. One gave me an 8 minute interview and another was 10 minutes. Both were very basic questions. I felt like they just interviewed me because HR gave them my information. 

All four were in the medical field. I have work experience but not in the medical field. I had everything the job description required.",1586167161.0,2020-04-06 05:59:21,April
907,907,"After making it on-site to an interview, doing multiple presentations, I was rejected. Now a month later, the position has been reposted. Is it a bad idea to reapply?",84,fuf47z,careerguidance,https://www.reddit.com/r/careerguidance/comments/fuf47z/after_making_it_onsite_to_an_interview_doing/,27,"I asked for feedback from the recruiter on the initial rejection and whether it was my experience or interview performance that contributed most to the rejection. He said that the team simply went with another candidate.

It’s a very selective company, and I got pretty far, but I don’t wanna jeopardize my chances. Especially since I have another first round interview with them for a different role next week.",1585972104.0,2020-04-03 23:48:24,April
