,index,title,score,id,subreddit,url,num_comments,body,created,date_created,month
1,1,Are you seriously trying to quit your job during a global pandemic and impending recession? o_O,1250,g4d70n,careerguidance,https://www.reddit.com/r/careerguidance/comments/g4d70n/are_you_seriously_trying_to_quit_your_job_during/,188,"This will probably be downvoted to hell. That’s okay. 

But really, there has been an uptick in people posting about quitting their jobs. This isn’t to berate you. If you aren’t happy, you really should find a way to leave. Your mental health and professional fulfilment is much MUCH more important in the long run. 

HOWEVER, if you know that you don’t have a fat kitty saved up or a wealthy family to fall back on- please don’t make the jump just yet! The same goes for those in jobs with an easier ‘replacement index’ or ‘entry bar’ (cringe). Don’t do it!

Think long and hard. Where I am, the depression from the lockdown retrenchments alone has led to a rise in suicides. Quitting your job and then finding yourself in the cold may put you in a worse off position.

This is sounding harsh but it is coming from a good place. Things are going to work out. We just don’t know when. In the meantime, hang in there. Take this global lockdown time to plan your exit meticulously, save up and start skilling up for the jump. 

Good luck!",1587351475.0,2020-04-19 22:57:55,April
50,50,Do you feel like COVID-19 is going to change the workforce permanently?,479,g7wa3g,careerguidance,https://www.reddit.com/r/careerguidance/comments/g7wa3g/do_you_feel_like_covid19_is_going_to_change_the/,249,"I feel like COVID could change the workforce for the better.

Instead of having to be glued to an office chair 5 days a week, I really feel like office jobs will convert to a WFH type of environment. On the off chance that you still do need to go to an office, I feel like the days you are required to be on-site will be reduced. 

&#x200B;

I also feel like the e-commerce business will be the way to go as people aren't going to want to really deal in hand to hand exchanges. Just my opinion. 

&#x200B;

What type of changes do you feel COVID-19 will bring about to work environment?",1587860640.0,2020-04-25 20:24:00,April
56,56,"What are some niche careers that while not that widely known, you think people should be aware of?",450,g8b8ss,careerguidance,https://www.reddit.com/r/careerguidance/comments/g8b8ss/what_are_some_niche_careers_that_while_not_that/,310,Pretty straight forward. I have heard a few people tell me that the career they are working in now isn't one they had ever even considered when they were younger. Got me to thinking that there are probably loads of career opportunities that people don't even know are out there.,1587920735.0,2020-04-26 13:05:35,April
57,57,My company keeps forcing everyone to do social activities on webcam as a means of overcompensating for the fact that we're working from home. I'm really not a fan of this. What should I do?,447,g59s3o,careerguidance,https://www.reddit.com/r/careerguidance/comments/g59s3o/my_company_keeps_forcing_everyone_to_do_social/,72,"I'm really not a fan of forced socialization (especially when it's organized ""team activities""), mainly because the type of work I do at my company (and in general) is very solitary and when I have a lot on my plate, I have always seen zero benefit in having to step away from my work and socialize in a way that doesn't feel natural for me.

Right now, my company is obviously working at home because of COVID. When I found out that we'd be working from home for an extended period of time, I was honestly really happy. As someone whose job requires a lot of focus and solitude, I really thrive when I'm just by myself and can zone in on my work without distractions. However, management keeps speaking to our company like they are worried about us all being shut-in and not being in the office. We're now forced to have some meetings every day (over Zoom), that we otherwise have once or twice a week in the office (for a couple of them, it's starting to seem like people don't know what to talk about). In addition to this, management keeps planning all of these ""social"" activities over Zoom that they aren't making voluntary.

I'm the only person who has my role at my company and we've taken a hard hit because of COVID. As such, I've actually had a huge increase in my workload since this has happened, which I've tried desperately to stay on top of. I won't lie - this situation has caused me to feel extremely burnt out and stressed as I'm trying my best to cope with everything. I feel like my main duty is to do my job and stay on top of it, and having to keep breaking my focus is making this so much tougher. I just want to be at home and focus on my work so I can get through this, and all of this forced social crap is infuriating.

I don't want to say something that will get me into any trouble, but I also don't understand why they are ""forcing"" these activities and not sort of advertising them for people to do if they wish/if they have spare time. Especially during a time where everyone is being put under stress and not everyone will be dealing with it in the same way. What should I do? Should I say anything to my manager or just stay quiet?",1587477739.0,2020-04-21 10:02:19,April
61,61,"Hello Millenials. I'm graduating university next year into the recession/depression, and I'm terrified. How did you survive the 2009 recession and its aftermath?",439,g5sklc,careerguidance,https://www.reddit.com/r/careerguidance/comments/g5sklc/hello_millenials_im_graduating_university_next/,169,"Hi! For the majority of my high school life/university career I've been working towards a creative communications career- pr, brand management, advertising. I've always been optimistic that I'd be able to either find or create opportunities for myself to make a good career path. I work part time for the canadian government, and I do some admin work for a small management company on the side. My plan had been to immediately move and find a job in my desired field, however I don't know how long the recession/depression is going to last after this and I don't want to be broke. So i guess my question is how did you survive the recession and is it possible to work jobs that are within your ideal career path but aren't as stable? How did you create a career path after the recession to a job that you do enjoy?",1587549650.0,2020-04-22 06:00:50,April
69,69,"Considering quitting my job, which I interact with the same 15 people daily, to protect my elderly relative I live with. I have money saved for est. 7 years of living expenses. Would you choose the job or make sure your relative is as safe as possible and quit?",418,ftppyx,careerguidance,https://www.reddit.com/r/careerguidance/comments/ftppyx/considering_quitting_my_job_which_i_interact_with/,118,"I go back and forth on this. I'm in one of those thankless jobs you fall into but stick it out for the paycheck. I'm 8 months when the pandemic hit. 15 people were considered essential, including myself. Reading the unemployment rate, I certainly having a new appreciation for just having a job and am humbled by that. It's a large building, though, and several companies are still open. So the real number I encounter, and the risk, is higher. 

On the flip side, I do have money saved and the IRS is giving me money from a mistake they uncovered so my new budget would put me at 7 years of living expenses covered. 

The concern is my mother. After the passing of my dad, I moved in with my mom to help her with little things. It's worked out surprisingly well, she's a sweetheart. 

Now I feel incredible guilt just leaving and coming home daily, putting her at risk. Her health, thankfully, is pretty good. She's a lovely person and I couldn't live with myself knowing I harmed her.

I drive under freeway signs that say to stay home.  I'm so tormented on what is the right thing to do. People scrambling to get jobs, I have a crappy one but, who cares, it's money coming in. If my mom didn't now rely on me so much, I would just move out but she does require a bit of daily care.

What do you think is the smartest move if you were faced with this? Oh, and thank you and wishing you well.",1585874830.0,2020-04-02 20:47:10,April
88,88,How do I tell the family I've been babysitting for that I need to be getting paid more then $25 a day?,385,fu5o77,careerguidance,https://www.reddit.com/r/careerguidance/comments/fu5o77/how_do_i_tell_the_family_ive_been_babysitting_for/,83,"Originally posted somewhere else but it got taken down and said I should post here. So please help me out. 

I babysit for this family. They have a 3 year old who I love to death. I've known the mom ever since I was little because my parents are friends with hers. The mom is 23 now. She WAS a single parent when she first needed me to babysit back in September. And now she is married. They are both cops that work in the jails. 

When she first needed me she was a single mom and I told her to pay me as much as she could and she told me she could only do $25 a day (she only needs me Saturday and sunday). So I was okay with it because that's all she could afford. I originally would start at 12:45 PM and go till 9:30 -10 pm and then she started to need me earlier. From 12:45, 12:30, 12:00, 11:30 am, 11am, and sometimes to 10am.

She ended up getting more serious with her boyfriend and he moved in so I ended up getting off around 7 PM. Now they're married so they have two incomes coming in. Their schedules got changed so now they both work from 5:30 am to 2pm, so they need me to come over at 4:45am till 3 PM. 

I did the math for how much im getting paid by the hour and it's around $2.72. I live with my boyfriend now, and with the whole coronavirus this is my only source of income since the other family I baby sat for doesn't need me any more.  I'm not sure if I should tell her I need to be getting paid more and I'm not sure how to tell her especially because when I needed to be paid in advance she did that for me and gave me $150. I ended up almost working all the days off for it, but she recently just told me that she decided to forget about it and started paying me again, so now I'd feel bad If I told her I need to be paid more

(Sorry if the grammar is bad. I'm tired of retyping thing lol)",1585936811.0,2020-04-03 14:00:11,April
117,117,"COVID19: Can my boss refuse to fire me and just not pay me if I demand to work from home, forcing me to quit?",338,fymkl4,careerguidance,https://www.reddit.com/r/careerguidance/comments/fymkl4/covid19_can_my_boss_refuse_to_fire_me_and_just/,54,"I am the Sales & Marketing Director for a privately owned assisted living community in Connecticut. It was hard enough to convince people to join our community after the virus hit when we weren’t allowing any more in person tours, family visits, and were COVID-19 free...

But then one of our residents tested positive for the virus after visiting another facility for outpatient services. Several of my community’s workers - CNAs, private duty aides, and food service workers all interacted with the patient in the time after she returned but before she was confirmed to have Covid19.  Most, but not all, were wearing facemasks, gloves, and eye protection during their interactions, but no one was wearing protective gowns or protective footwear. A couple hours ago one of the exposed food service workers was sent home with a 102 degree fever...

I have a wife and several children, all younger than 10 years old. I came into the office today for what I thought was the last time and told my boss that I no longer could come to the community and would instead work from home. I also let him know that if this was not okay, then it would be best to let me go so I could file for unemployment and look for a new job.

About an hour later I hear from the owner of the community who tells me that if I don’t come in and work out of the office, he will no longer pay me and I can quit if I don’t like it. He said he won’t fire me, he just won’t pay me - preventing me from applying for unemployment benefits. When I told him that this was against the law, his reply was, “Sue me, then.”

What the hell can I do?  Can I quit and still collect unemployment?",1586575045.0,2020-04-10 23:17:25,April
127,127,"I've been unhappy with my job for a while and was looking to leave at this time, but now I feel stuck because of COVID. What are some good ideas to consider moving forward?",332,fuwy9w,careerguidance,https://www.reddit.com/r/careerguidance/comments/fuwy9w/ive_been_unhappy_with_my_job_for_a_while_and_was/,41,"I’m sure I’m one of MANY people posting about this same problem, so I’ll first just apologize about this in advance. I’ll also preface this post by saying that I know I’m fortunate to not be out of work right now.

I’ve been pretty unhappy with my job for some time now, and right around this time was when I was planning to look for another one (ironically, I had gone on a trip before COVID-19 broke out and my plan was to do this after I got back home). In summary, here are the reasons why:

* Long hours, understaffing and me agreeing to way too much in the past year has led to me wearing far too many hats. I’m burnt out, never able to complete everything each week and management is aware, but doesn’t seem to do anything about it.
* My role has changed from one where I was supposed to be a creative contributor to my company to one where I just manage and oversee logistics all day. It wasn’t what I signed up to do and I don’t even get to do any of the responsibilities I was originally given when I started (which was work I actually enjoyed, is in line with my skill set and that was valuable for both the company and my resume). Duties that were once mine are now just outsourced by third parties and managed by me. It's definitely not the same thing as what I joined to do, at all.
* Management knows I want to go back to my original duties and have repeatedly told me they will do this for me and reevaluate processes, only to then keep roping me into the very duties (mentioned above) that keep me from doing just that and doing absolutely nothing they promise.
* Management is young, inexperienced and not good at fixing problems when they’re brought to attention. This results in me and other colleagues getting the brunt of other people’s problems.
* According to market trends (at least before COVID), I was being underpaid and overworked for this role. I’m not sure if this still stands now.

Overall, I’ve been unhappy for quite some time now and I don’t feel like this job is at all aligned with my career goals at all. I’ve managed to keep my job and work from home during the pandemic, which makes me feel like an even bigger POS for complaining. But with that being said, I can tell that taking our company online is already starting to worsen the lack of organization and alignment. On top of stress over what’s happening in the world right now, I know my mental health is not in great shape dealing with this role. Even prior to this, I was dealing with working late hours, extreme burnout and lack of sleep. I still want to make the best of my life and my career during this time and I know I’m not doing it here.

With all this being said, I am perfectly happy with working from home (I'm a bit of an introvert and actually fare really well with it) and the type of work I do is very easy to do remotely. Is it worth the risk to still look for something else right now or am I making a bad move? I’d love to know if anyone else has greater insight on the remote market right now or what that’s looking like. It's been over a year since I've looked for a job and I've never looked for a wholly remote opportunity before.",1586047825.0,2020-04-04 20:50:25,April
147,147,"Is it worth it to leave a high paying job that makes me miserable, for one that pays less but doesn't make me cry daily?",311,g6dwc8,careerguidance,https://www.reddit.com/r/careerguidance/comments/g6dwc8/is_it_worth_it_to_leave_a_high_paying_job_that/,71,"&#x200B;

&#x200B;

I work in the hospital lab in a very specialized position. Specialized to a point there are only 1500 of us in the country roughly. One of the bigger cons of this is I can't just go work somewhere else. If I had a family that lived here and something happened or I quit, I can't go to the town over or down the road, I would have to move hours away for another job. I feel like I am forever at the mercy of my employer.

&#x200B;

I got into 4 different masters programs when I finished college. I did so many different jobs, trying to find the one that felt right. My mom has always been money minded, so when I got into my graduate program with the expectation of making 75k+ a year, she was thrilled and pushed me to do it. I was excited, and this program had a higher salary and a higher liklihood of employment (though limited, they don't tell you that part). I started med school not fully knowing what it was, but got through everything just fine with great grades. During rotation year I remember thinking ""Is this what I want to do for the next 30 years of my life?""

&#x200B;

I started working at my current job a year ago. Two months in, I was already uncomfortable. The healthcare field is viscious, and our leaders in my group are as well. Since I've started I have seen the revoling door of employment, and have seen 8 people come and go since my first day, only 8 months ago. When I started, I was making 75k, and as a new graduate with more loans than that number I was happy. But as time went on, I became a wreck. My ex left me for a week because I would just come home and cry. I was miserable. I've applied to other places, but it's so specialized and so few positions anywhere even remotely close that I am SOL most of the time. I wondered why the people I worked under during rotations seemed so burnt out and miserable, saying the spark will go away fast, and now I know. 

&#x200B;

Fast forward to today. Recently it's gotten worse. Everybody's pay got cut at least 20-25%. My hours got increased, and I'm doing 55 hours a week now. I am constantly walking on eggshells waiting to get in trouble for sneezing when I should have coughed, knowing if even a whiff of something not perfect gets out that I will be absolutely fired. 

&#x200B;

Besides the employer issues, this job may physically be killing me. I'm pretty certain I will have a stroke by 40 with all this stress. Once I'm off work, I can't relax. On top of that, my back is constantly hurting, and that's just how it is and nothing can fix or prevent that. This job is also just relatively dangerous, and I've already gotten pneumonia and TB from patients before. 

&#x200B;

My passion is dead. It was short lived, it existed momentarily, but it's dead.

&#x200B;

I told my mom months ago I wasn't a fan, she told me it's just a phase. I told her in winter, again, suck it up you don't mean it. Now that the world is falling apart and the hospital is running itself and employers into the ground, I told her again that I'm not in love with this job. It makes good money, but I'm not happy. I can't have a family or relationship and feel happy knowing 1/3 of my day is spent in nonstop worry and anxiety. I told her I want to look elsewhere for other jobs, and she said I am being dramatic and need to stop, they put themselves on the line to hire a younger person, I have debt this is what being an adult is I need to suck it up, and this is just a rough patch. She's mainly concerned with the money I make, and it always. comes. down. to. the. money. At this point, making less than 50k terrifies me because of how she has made me feel over the years. 

&#x200B;

I have been searching for jobs, and i can find other ones in other fields. I would be making above 50k, but not as much as I am now. I feel like I failed though. I got into my program, I was the head of the student side of things, I was the first to get a job, I graduated, I got my license. I did it, and I don't want to do it forever. I genuinely feel like I am doing something wrong, or I'm a bad person, for feeling this way. I want anything else, literally anything else. Is this a horrible mistake?",1587634602.0,2020-04-23 05:36:42,April
198,198,How do I politely ask for the salary so I’m not wasting my time doing multiple interviews?,279,gabh28,careerguidance,https://www.reddit.com/r/careerguidance/comments/gabh28/how_do_i_politely_ask_for_the_salary_so_im_not/,72,"I’m interviewing with a company overseas and I’ve done 3 interviews already and I thought I would know how much the pay would be on the third interview since they asked about my current pay but they said they’d like to conduct another interview before offering. I would hate to do 4-5 interviews just to find out the pay is not what I expected or for them to find out I’m asking too much, so I how do I politely ask for the salary so we don’t waste each other’s time? Thanks",1588202580.0,2020-04-29 19:23:00,April
208,208,Is a bad boss a good enough reason to quit my job?,274,fvfmnh,careerguidance,https://www.reddit.com/r/careerguidance/comments/fvfmnh/is_a_bad_boss_a_good_enough_reason_to_quit_my_job/,95,"I (25f) was the first to be hired in a Marketing role at my company about 6-7 months ago. I've been working on anything design branding and marketing for both print and digital however I've had no say in anything, that includes the copy content or often times how something should look. Reason being is that the COO thinks herself a marketer.

Now to give you a background she's a year 9 highschool drop out who started to date the CEO who made her the COO of the company. Because she finds marketing ""fun"" she constantly takes over my role and produces quite terrible work. 

She tells me I don't understand how ""academic"" think so I couldn't produce good work (I have multiple degrees, diploma, and certification). I find how she talks and does work honestly insulting to marketing and design industry to be quite honest let alone to the company as a whole.

The staff are kind and I'm happy with the pay but she drives me mental every.single.day. at 25 I'm happy to have someone wiser to teach me and guide me in bettering my skills but with her at the most, I'll just develop bad skills.

I'm a one person department with no one else to speak to...

I decided to start looking for new jobs...lets just hope with COVID-19 I do find something but am I being immature? I know there's always someone or something in the company but after 6 months I can't imagine her to change and she'll obviously always be in the picture.

Just an update: I'd never quit without a job lined up and plenty of financial resources.
I'm from Australia, so health services is not really an issue and Covid-19 has not impacted us as badly.

I don't mean to bring insult to anyone without an education. I'm the first to graduate in my family...heck, my dad can barely read and I find him wisest of all :)",1586129748.0,2020-04-05 19:35:48,April
217,217,Do you think that companies will start asking questions in interviews about how an applicant used the coronavirus lockdown to work on their personal development?,269,gano3d,careerguidance,https://www.reddit.com/r/careerguidance/comments/gano3d/do_you_think_that_companies_will_start_asking/,102,"**Edit: there are too many comments for me to reply to them all, but thank you everyone! This has really put my mind at rest. It's also made me consider how I could use this to find out whether a company is a good employer or not. Stay stafe**

Hi all,

For context: I'm a final year university student who will hopefully be 'graduating' this summer. I'm also currently applying for jobs, which is obviously not ideal in this climate.

I'm not dealing very well mental health wise with the current lockdown. I've got a few final university assignments to do, which I'm struggling to get done, but other than that I don't feel at all able to do... almost anything else. I'm seeking help etc. (I'll save you all the long details!), but I'm barely fulfilling the basic functions of a human being at the moment, let alone learning new skills, taking online courses, or generally working on my personal or professional development.

I'm worried that, over the coming months/year(s) I'm going to be asked about how I used this period to improve myself and make myself a better candidate, and that I'm not really going to be able to say anything. I can say that I was working on my university work, and that I've done a little bit of aid volunteering (it's an ad hoc kind of thing), but I reckon that lots of people feel more able to use this time to do lots of impressive stuff. That's how it feels among my peer group, anyway. I was already less than confident about getting a job after I graduated, but it would really suck if this was another blow.

I know that many of you are currently seeking employment/might work in recruitment etc., so I was just wondering what your thoughts were. Let me know if this is the wrong sub!

Thanks :)

Disclaimer: I fully realise that people have *far* *far* bigger problems to face, and that I'm in a pretty fortunate position.

TL;DR: for mental health reasons, I haven't been able to work on my personal development during lockdown, and I'm worried that this will hold me back in future job interviews.",1588244363.0,2020-04-30 06:59:23,April
