,index,title,score,id,subreddit,url,num_comments,body,created,date_created,month
279,279,"Can you please suggest something to learn during the quarantine, so that it will help me get a job later?",236,fpajqa,careerguidance,https://www.reddit.com/r/careerguidance/comments/fpajqa/can_you_please_suggest_something_to_learn_during/,75," Hello everyone!  
I just found this channel. I hope you're all doing fine.  
It was a long time ago since I posted something here.  
I graduated BA in English and Communications, but I really didn't like my major and was forced by my family to study there. I am in this big messy situation, I really love drawing. For the past 4-5 years, I have been drawing and I really had improved my skill. However, I can't find a job in my country (Armenia). So some of my relatives and my family members keep pushing me to find new interests and search jobs in different categories. I would like you to suggest some areas (such as programming, software testing, etc). My friends suggested me UI/UX design, web programming, and others. I just can't find any interest, so I beg you, please suggest me something.

Thank you in advance!  
P.S. Don't lose your hopes! We will beat through the virus!",1585253938.0,2020-03-26 16:18:58,March
285,285,How do I tell my job I don't want to meet clients due to covid-19?,237,flxq3r,careerguidance,https://www.reddit.com/r/careerguidance/comments/flxq3r/how_do_i_tell_my_job_i_dont_want_to_meet_clients/,27,"Basically I am insurance adjuster. I am low level so I do all the field work such as canvasses and interviews. I have been authorized to do most of my interviews over the phone already however, I have a 3 year old daughter and live with my parents who are 56 and not in great health. Me going to knock on doors and meet random strangers around a large metro area seems irresponsible at this point. 

They only company response we have had is that we can expense sanitization products. I am very fortunate to work remotely for the most part and be paid. Second due to the virus they can't really replace me or get mad because it's not great hiring time. Lastly I am getting blow back from my whole family about going out. How do I frame this to my employer. They are understanding and nice, but I haven't pushed back yet and am basically I am a mindless yes man and produce tons of work because I just treat it like the army and do whatever I am told.",1584749869.0,2020-03-20 20:17:49,March
318,318,Is Corona virus affecting the job market? & Any excel learning advice?,219,fhgihm,careerguidance,https://www.reddit.com/r/careerguidance/comments/fhgihm/is_corona_virus_affecting_the_job_market_any/,123,"I’ve been having trouble getting employed. I haven’t received an interview interview since early February and I’m starting to think that employers are going to start being precautious and many will put a hold on hiring.

What are your thoughts?

If this does happen, what should I do meanwhile?

Also: does anyone have any tips/videos recommendations to be proficient at Excel?",1584049346.0,2020-03-12 17:42:26,March
320,320,How long did you spend at a job you hate?,220,ffy0wn,careerguidance,https://www.reddit.com/r/careerguidance/comments/ffy0wn/how_long_did_you_spend_at_a_job_you_hate/,151,"Long story short, I’ve been with my current company for coming up 2 years. My first job out of college and it’s a great job, pays well, great benefits etc. But there’s one huge problem which is I absolutely hate it and have felt this way for months. I desperately want a change and I’d like to do entirely different work from what I’m doing now. Problem is it’s been hard to find something I ACTUALLY want to do so I’m not in this same position after a year, so anybody ever been through something similar as this? How did you go about navigating through this time?",1583802836.0,2020-03-09 21:13:56,March
335,335,"27 and never had a job, just sold my business, how to transition to career?",216,fe9rag,careerguidance,https://www.reddit.com/r/careerguidance/comments/fe9rag/27_and_never_had_a_job_just_sold_my_business_how/,86,"I've been running my small online business since I got out of highschool.

Learned a bunch of stuff along the way and was able to scale my digital services business to over $1.2m/yr in revenue. I am now selling the business for a very healthy sum, around $4M so I won't really have to worry about money too much.

I just want to invest that money and let it sit while I find some new work. I would love to work in online advertising or ecommerce, as these are 2 things I feel I know the most about.

I've gotten a resume professionally made and applied to a bunch of jobs in random pay ranges for these fields. $50k/yr SEO jobs to $200k/yr VP of eCommerce jobs.

I don't really get any replies. I don't have a degree or any job experience so it is hard to get interviews.

Online advertising/eCommerce are performance based industries, you either make money or lose money. Fairly binary. I have a 7+ year track record of 6 figure profits purely from my digital marketing acumen with the analytics to prove it.

How can I successfully angle my way in to the type of career I want?",1583506685.0,2020-03-06 09:58:05,March
336,336,How to quit a job without telling the truth?,215,fd2vcf,careerguidance,https://www.reddit.com/r/careerguidance/comments/fd2vcf/how_to_quit_a_job_without_telling_the_truth/,71,"So I've just been offered a job today in a different company and I am really scared of telling my manager/CEO the truth of why I will be leaving.

So our company is quite small - growing moderately - and without sounding big headed, I have helped the company grow a lot. I know they really need me and my skills as a designer, however my manager takes most of the credit of my work, therefore he is getting promoted more than me (I also get the fact he is the manager) and instead I have received a small salary increase instead.

Anyways, the manager treats me like crap most of the time, our boss can also be horrible and demands the best quality of work with the shortest amount of time possible (so working OT/working over weekends) and if you don't deliver, you're just not good enough for their company. My manager has honestly been horrible to me, even the staff in different departments commented on how he speaks to me.

My notice period is a month, and I know for a fact he's going to be so horrible when I tell him I will be moving to a different company (sort of a competitor too), and I'm just not willing to sit through for a month of hell. He's currently been nice because one of our ex assistant had left a horrible glassdoor review of working for the company.

What should I do? Should I lie that I'm leaving the city to go back home? I know he will be constantly asking and prying for the rest of my notice period so I can't exactly say 'I can't tell you/I don't need to tell you'.

Help/advice will be appreciated!

Thank you.

&#x200B;

\*Edit

Wow, I didn't expect so many responses, I was hoping to get 1 or 2 advices. Thank you so much for all your replies, it's helped me feel more confident to hand in my notice tomorrow! Nervous still - but I'm going to do it! ",1583303677.0,2020-03-04 01:34:37,March
357,357,How to stop feeling stupid when speaking up in meetings?,204,fm44km,careerguidance,https://www.reddit.com/r/careerguidance/comments/fm44km/how_to_stop_feeling_stupid_when_speaking_up_in/,48,Especially when your contribution gets what you feel like is a lacklustre response or gets ignored. Is everyone secretly judging you/thinking of how stupid you are?,1584772137.0,2020-03-21 02:28:57,March
367,367,Which companies did not retract job offers due to covid-19?,203,fr54xq,careerguidance,https://www.reddit.com/r/careerguidance/comments/fr54xq/which_companies_did_not_retract_job_offers_due_to/,69,"A few days ago I received the news that my job offer for a business dev position from a fairly large IT firm (\~$4B annual revenue, >10K employees) had been retracted.

does anyone know which companies have not retracted their job offers and/or what positions?

TYSM! -- would been great to know, now that like many others I'm back on the search in a terrible job market

take care everyone, hope ya'll staying safe (physically and job-wise)

\*\* thanks for your comments! hoping fewer people have to go through the same experience.",1585513575.0,2020-03-29 16:26:15,March
380,380,"Coworker is acting like my manager, am I taking things to personally?",194,fhsp9a,careerguidance,https://www.reddit.com/r/careerguidance/comments/fhsp9a/coworker_is_acting_like_my_manager_am_i_taking/,45,"Potentially in need of some constructive criticism, but I’ve been feeling managed by one of my coworkers as of late. I’m wondering if she’s really trying to be helpful or if she’s campaigning for a supervisor position. We are on the same team & have the same job title. Also worth noting, I have been doing this job for 3 years, she has been with the company for a couple years but is new to this role. She is also at least 30 years older than me.

Today she sent an email to myself, my manager, and a couple of other coworkers that I work closely with. It included a list of “best practices” when onboarding our clients and said she was excited to teach me how to do so. Again, this is a job I’ve been doing for 3 years and have never received a complaint about my quality of work. The kicker about this email is that she also felt the need to copy and paste our job description into it.  I spoke with a coworker that was also on the email to see if I had missed something and to find out why this email was even sent, and that coworker confirmed that I have not had any missteps in these areas so the email seems very out of the blue. 

There have also been a couple of instances where she checks in to make sure I’ve done things on my accounts that she is not involved in. Every time she asks these questions the answer is yes, I have done it, but she continues to go out of her way to make sure I’m doing my job.  It’s out of character for members of our team to check that other teammates are completing work properly, (whether that’s right or wrong for our organization I’m unsure) I can’t imagine ever doing this to another member of my team. It feels like she’s stepping on my toes but I don’t want to seem ungrateful if she truly is trying to help. 

Any advice on how to handle / constructive criticism if I’m taking things to personally are welcome!!",1584096179.0,2020-03-13 06:42:59,March
409,409,"Do people in elite fields (investment banking, management consulting, big law etc) tend to be more cold-hearted compared to others ?",189,fmdcea,careerguidance,https://www.reddit.com/r/careerguidance/comments/fmdcea/do_people_in_elite_fields_investment_banking/,36,"I've always noticed this elitist feel about them. Like to them they only care about results and anything else that gets in the way of results (apart from blatant illegal stuff) is a bother to them. 

People in this field usually attract a lot of Type A aggressive people that can make really hard decisions such as giving advice to close down a factory and laying off the employees etc.",1584817375.0,2020-03-21 15:02:55,March
420,420,How to learn soft skills?,182,fh7mfk,careerguidance,https://www.reddit.com/r/careerguidance/comments/fh7mfk/how_to_learn_soft_skills/,54,"I've developed bad personality traits that impede my job search. I have skills which most employers like and invite me to interview but lack joyful, ecstatic, friendly skills. 

I consider myself to be a stoic type but it comes across as apathetic and lethargic.

Any ideas on how to improve? I do have a good work ethic but putting on a smiling face is hard for me.",1584002258.0,2020-03-12 04:37:38,March
425,425,25 and my career is RUINED. How do I get it back on track?,181,fjvtjv,careerguidance,https://www.reddit.com/r/careerguidance/comments/fjvtjv/25_and_my_career_is_ruined_how_do_i_get_it_back/,58,"Hey everyone! I need some help. I am a 25-year-old college grad, trying to pursue a career in marketing/ media. However, due to a series of setbacks (some of them my fault, others not so much), my resume is terrible. It's basically a collection of short-term jobs, all of which have had really terrible endings...which is also an issue because it makes me uncomfortable using references. My work history is riddled with gaps, as well.

I feel like I'm in a hole, and don't know how to get my career back on track. I have so many resume gaps, and haven't even had one job for an entire year yet. I really want to start working on my professional goals, but feel as though a couple wrong moves that I made immediately after graduating have set the tone for my career moving forward- and it's very far from the one I wanted.

***Please note:*** *While grad school would be a good solution, I cannot afford it and even if I could, I've missed the deadlines for several schools with ""mandatory summer starts""; meaning I'd have to wait until summer 2021 to start, which isn't an option.*

Here is a **timeline of my professional life since graduation**.

**Background:** 

\-Graduated in 2017 with a major in Media Studies (focused in Advertising) and minors in both Marketing and Creative Writing. 

\-Had a few great internship opportunities, while still in school- one with a major media company (wound up not working out because I lived in Virginia and couldn't get to Los Angeles in the time span they gave me), and the other was a remote internship with a large online magazine, which I completed.

\-Graduated with honors, 3.3 Cumulative GPA and 3.6 Major GPA.

\-Was in long-term relationship (nearly 5 years) with guy whose graduation was pushed back a year, due to changing majors- meaning, he was staying in the college town and I would be too, seeing as we'd been living together for years.

**Timeline:**

***May 2017-*** Graduated

***Summer 2017-*** Worked at marketing internship w/ large restaurant chain in college town, in order to stay with boyfriend. 

***Fall 2017-*** Took a call center job, in order to make money while job hunting. Still doing this to stay with boyfriend. *Stupid decision.*

***December 2017-*** Could not find job. Got cheated on. Wound up quitting call center job, breaking up with boyfriend, and moving back in with parents.

***Winter 2018-*** Applied for full-time jobs, while working as a ""temp"" secretary (with some unofficial marketing work) at a real estate company, through a staffing agency.

***Spring 2018-*** Could not find a full-time marketing job, with so little experience. Was offered a full-time job with Real Estate company, a.k.a. ""buyout"" from staffing agency, so I would be an official employee, not a temp. Promised marketing/social media responsibilities. Decided to pursue this. Even submitted application and deposit for company-owned apartment next to office.

***May 2018-*** One manager turned out to be mentally unhinged. Stole my $250 deposit for the apartment, stole my SSN, and more. Upper management knew she had done this for days before reporting it to me. (Long story). I quit the job.

***June 2018-*** Got together with new boyfriend. Applied for marketing jobs, but was unsuccessful. Temp agency stopped working with me because I had called the authorities on my former employer for stealing from me. Basically said that their business w/ the company was more important than me.

***July 2018-*** Boyfriend got job with large tech company in Silicon Valley. I had always wanted to go to California and so had he, so we decided to take a leap of faith and go, despite me not having a job lined up. Stupid decision.

***August 2018-*** Moved to Cali. Had been applying and still was. No responses.

***Fall 2018-*** Job hunt unsuccessful. Even fast food places weren't hiring. Too many people, not enough jobs. Did not have a car, which lowered the radius I could travel and hurt my chances further. Went into crushing debt.

***Winter 2018-*** Went home alone for a month or so, to get my finances back under control. Applied for jobs.

***January 2019-*** Received job offer from startup in Silicon Valley. Accepted offer and returned to boyfriend in California.

***Winter/Spring 2019-*** Worked my a\*\* off for company, barely making anything ($20/hr in San Fran- no time and a half for overtime, which happened a lot). Started to notice some shifty things about them- paying me through Venmo-like app, no incoming revenue, etc. 

***May 2019-*** Found out from people ""working for us"" that they were being tricked into free labor. Tried to talk to employer to fix this and make company legitimate, but was shut down. Started applying for other jobs.

***Early July 2019-*** Startup tanking. People quitting left and right. Mental health rapidly declining. Received offer for a job a few states away, so I quit and moved with my boyfriend.

***Late July 2019-*** Got to new city after a long road trip. Called new employer to verify address and start time for first day that Monday. Found out that they had decided to hire an internal candidate at the last minute, and I was never informed. At this point, I'm in a new city and I'm homeless and unemployed.

***August 2019-*** Started working with local temp agency. Got good Marketing gig. Pay was low, but it was work. The contract was for one month, but they were planning on hiring me full-time after it ran out. Even had me write out a list of things I needed for the Marketing department for upcoming year, in order to get them approved during budget meetings. They were approved.

***September 2019-*** Received a phone call on one month anniversary of starting job. It was the temp agency. They said the company couldn't afford to hire me, so they were taking me off the position immediately and would find something else for me. I was devastated, but had no say. Contract said company couldn't work directly with me for a year after contract ended.

***Fall 2019-*** Temp agency could not find anything and basically ghosted. Unemployed, except for an odd job here or there. Broke. Crippling debt getting worse. Applying for jobs every day. Unsuccessful. Every marketing company that contacted me back was one of those MLM scam agencies, posing as legit businesses. 

***November 2019-*** Went home again for financial and health reasons. Kept applying for jobs.

***December 2019-*** Had a few interviews, but got turned down for a few things due to being home for the holidays. Finally got an offer for a phone sales role. I had little interest, but needed the income.

***March 2020-*** Have been working at new job since early January 2020. Pay is low. Hours are long. Metrics are unreasonable, and valued over actual productivity. Forced overtime with no pay. Employer won't even let us work from home during Coronavirus outbreak- despite having the tech to do so and confirmed/suspected cases among employees. I need to find a new job to transition into, once quarantine is over. 

&#x200B;

**So, here I am.** In the past, I've been told by hiring managers that my short-term assignments, lack of updated references, and resume gaps are red flags. I get that 100%. However, ever since graduating, I've been applying to crazy amounts of jobs each year and have been getting turned down due to lack of experience for 95% of those. Meanwhile, the jobs that have interviewed/ hired me have unfortunately been so easy to get a job with, or so it would appear, because they're not good companies to work for.

I am so set back in my life right now, all while desperately trying to get out of debt, get legal help for the cases that require it, and get my career started. I'm so depressed having to pay my student loans each month, despite not having worked one day in a full-time, salaried marketing role since finishing school.

&#x200B;

**What can I do (other than go to grad school), to get my career back on track?**

&#x200B;

**TL;DR:** Since graduation, I haven't been able to secure a good job due to lack of experience. The companies that have hired me have been terrible to work for, resulting in short employment periods, a lack of recent references, and lots of resume gaps. This is affecting my ability to get a good job in my field and I don't know how to turn things around. Please help.",1584434201.0,2020-03-17 04:36:41,March
428,428,People with 2 jobs. Are you constantly tired or have you managed to make it work?,181,fn8bbr,careerguidance,https://www.reddit.com/r/careerguidance/comments/fn8bbr/people_with_2_jobs_are_you_constantly_tired_or/,66,"I’m thinking about getting a second job but I don’t know if I’ll always be exhausted. Do you think working from 11pm-7am and then a different job from 8am-4pm appropriately 5 days a week is unreasonable?

Update: Thanks for all the responses everyone! I appreciate hearing about your experiences. The majority consensus I’ve gained from you is 2 back to back full time jobs aren’t a good idea.

Also a few of you have asked, the reason I want a second is money. My current job is horrible pay but it’s good experience for my degree. So I’m looking for a second job in any field. I’m not struggling right now but I’m in my 20s still living with my parents, I want to save enough money to get my own apartment already.",1584943816.0,2020-03-23 02:10:16,March
469,469,Low stress and flexible jobs?,173,ff0rh0,careerguidance,https://www.reddit.com/r/careerguidance/comments/ff0rh0/low_stress_and_flexible_jobs/,99,"I just quit my brutal job doing industrial construction working 70+ hours a week in awful conditions. That job really broke me and makes me never wanna work again. I have business aspirations but I need a job to bridge the gap until I get there. I need something that gives me freedom to live my life how I’d like to, whether it’s work from home or independent contractor work or whatever, I don’t care. Money is lower on the priority list. I just wanna do something somewhat productive that doesn’t make me wanna kill myself.",1583640810.0,2020-03-07 23:13:30,March
531,531,How normal is it to attract one enemy in every work place you go?,157,fc9m1a,careerguidance,https://www.reddit.com/r/careerguidance/comments/fc9m1a/how_normal_is_it_to_attract_one_enemy_in_every/,123,"It never fails, every work place I go, I attract 1-2 people that dislike me. They say there’s always someone that will dislike you. I say 1-2 because that’s how many people that make it evident to me, there may be more I am not sure. I’m quiet and to myself, I don’t go out of my way to please people and make a great impression. I used to and that still led in being treated like crap. There are those that seem well liked and happy, I’ve never been so fortunate. Am I just unlucky and it’s by chance I encounter tension? Or am I unrealistic and this is common? I’m 25 and this is my first real job in higher education.",1583169985.0,2020-03-02 12:26:25,March
549,549,What are some careers in the healthcare industry for introverts?,155,fmzqo7,careerguidance,https://www.reddit.com/r/careerguidance/comments/fmzqo7/what_are_some_careers_in_the_healthcare_industry/,57,"If you're not much of a people person, what are some careers in the healthcare industry that could be a good fit for a person like this?",1584911475.0,2020-03-22 17:11:15,March
