,index,title,score,id,subreddit,url,num_comments,body,created,date_created,month
428,428,Why are all university job advisors terrible?,441,gk9x0g,jobs,https://www.reddit.com/r/jobs/comments/gk9x0g/why_are_all_university_job_advisors_terrible/,139,"Spoke to a career advisor at my university for the second time and I'm fed up. I'm mostly frustrated with myself because I don't know what I want to do but at the same time career advisors also seem to have no idea what they're doing unless you know what you want to do. Seems like they're only there to validate you instead of helping. I tested this by telling my career advisor I wanted to go into documentary filmmaking after studying urban geography and she was like yea go for it! I'm just feeling lost and wondering how people here found their careers, if you planned your career or if your career fell into your lap/you stumbled in on it. What resources would you guys recommend for finding jobs/career planning?

Edit: thanks for all the support! I want to provide some clarification. I'm going into my fourth year of university so while I think documentary filmmaking is really cool I've never taken a film class and can barely hold a camera so I don't think that's a career I can go into. I told her making money was important to me and she recommended activism as a full time job. She also tried to fight me on my  own experiences because she noticed I changed my major. I used to be in international development and I realized how terrible and degrading humanitarian work is. I told her it was absolutely a field I would not consider since humanitarian work actually perpetuates the cycle of poverty in developing countries and she said ""well in those countries it's step by step u know"". I actually do go to a pretty prestigious university in Canada but we do lack funding.",1589581026.0,2020-05-15 18:17:06,May
467,467,"If a company tells you they're like a family, is that a red flag?",426,gni1l0,jobs,https://www.reddit.com/r/jobs/comments/gni1l0/if_a_company_tells_you_theyre_like_a_family_is/,166,"If you're in an interview, and you ask them about the culture of the company, and they say they're ""like a family"" and ""no office politics"", is that a red flag?

In my experience, there is no such thing as a company that's ""like a family"", and if they're like my family, there will be constant arguing.",1590031669.0,2020-05-20 23:27:49,May
478,478,Is LinkedIn a waste of time?,422,gmm1e9,jobs,https://www.reddit.com/r/jobs/comments/gmm1e9/is_linkedin_a_waste_of_time/,119,"All I keep getting on LinkedIn are corporate shills, con artists and snake oil salesmen. 

 I will get a lot of messages from strangers on LinkedIn who will proceeds to make small talk about some innocuous topic, say, the weather,  that cool show on TV, my future goals, and then seemingly out of  nowhere the conversation is abruptly derailed by an obviously scripted sales pitch filled with big fancy words like Business Development Managerial Marketing Financial Literacy E-commerce Leadership Training  Entrepreneurial Fortune 500 Social Media Coaching Customer Acquisition  Teaching Management Business Affiliate Online Team Building Role. 

Examples:

&#x200B;

[Exhibit A](https://preview.redd.it/lm77v9g58pz41.jpg?width=262&format=pjpg&auto=webp&s=58e3ae15f90588ed87da62404c1bae459c80b780)

&#x200B;

[Exhibit B](https://preview.redd.it/krzv1f088pz41.jpg?width=255&format=pjpg&auto=webp&s=44bdf3084602c1d71ed694def5c62acd19a9ec34)

&#x200B;

[Exhibit C](https://preview.redd.it/xunvzfoa8pz41.jpg?width=254&format=pjpg&auto=webp&s=bdc19f371d0a21c3461219dc984f0d680e75b033)

&#x200B;

[Exhibit D](https://preview.redd.it/224bd1lc8pz41.jpg?width=267&format=pjpg&auto=webp&s=51d00c66b00b6bac14b90290c303f86f6f146a2b)

These are all from different people and they just keep coming, I don't mean to be negative but LinkedIn just seems so toxic. It's either this or people shilling for corporations about how 'great' their job/internship is and it all just seems so fake and force. 

I want to use LinkedIn to get jobs and connections but I have no had any luck or maybe I am just using It wrong? Any advice would be appreciated?",1589913157.0,2020-05-19 14:32:37,May
484,484,My boss sends me early morning (8am) meeting invites to me on the same day but even earlier (7am),414,gqzj99,jobs,https://www.reddit.com/r/jobs/comments/gqzj99/my_boss_sends_me_early_morning_8am_meeting/,141,"There have been times where I missed meetings (with important people) because my boss forgets to initially send me the meeting invite. She’ll forward it to me the same morning but it’s early enough in the morning that I’m either sleeping or haven’t checked my work emails yet. She sent one to me this morning after a long weekend and I missed the meeting. 
How should I respond to this?

Update: 
My boss and I had a 1-1 where she told me she was surprised I did not join the meeting. I told her I checked my email late last night to see if she had set up a meeting and she didn’t. Just for more info this was a meeting that she had mentioned she would set up which is why I was looking for the invite last night and since I didn’t see one I assumed it wasn’t yet scheduled.

More info— 
My boss told me about this meeting at 4:30pm on Friday over a call and she had mentioned she would “probably” set when one up Tuesday morning. We had a long weekend so when I checked my email last night (Monday night, a holiday) there was nothing there, so I assumed “okay she probably ended up not setting up the meeting”. Not only this but when I got the email invitation today it turns out she sent the email invitation out earlier than the meeting that took place with me on  on Friday where she told me she would probably set up a meeting. I asked her to send me an invite as soon as she set it up. Given that she is my manager I did not think I need to keep following up with her on a meeting that she told me she would set up and send. Also, even if at any point I had followed up with her, the soonest I would have gotten a response is early Tuesday morning  (since Monday was a holiday). My normal day starts at 9am and I get paid hourly. My boss knows this as I have had this discussion with her.",1590536970.0,2020-05-26 19:49:30,May
501,501,I need to get out of police work.,408,gj6d7w,jobs,https://www.reddit.com/r/jobs/comments/gj6d7w/i_need_to_get_out_of_police_work/,246,"I have been a police officer in Washington State for 25 years and am currently a detective working sex crimes.  I am mentally and physically burned out on it all.  To say the least, this career has not been good for my mental health for the reasons that one might guess.  

I am looking to go into a career that has nothing to do with law enforcement.  I am a creative/arts type, feel that I am an excellent writer, that I have good problem solving skills and am able to multi-task well.  I have only completed two years of college out of high school for the prerequisites, but was hired into the field at 21 before completing a bachelor’s.

I have seen some excellent advice on this forum and figured I would put myself out a bit and see what happens.  Take care all of you out there during these strange and trying times!",1589428494.0,2020-05-13 23:54:54,May
507,507,Applied to nearly 100 different companies over the course of a month. I either get rejected or I don’t get a response.,406,gsmsj2,jobs,https://www.reddit.com/r/jobs/comments/gsmsj2/applied_to_nearly_100_different_companies_over/,178,"Title says it all.

I, like many others, have been laid off due to the pandemic and have been furloughed from my current employer since March. I started applying for entry-level positions anywhere I could find, I even applied for some management positions as well since I have previous management experience. 

I either get a “Thanks for applying, but...” or nothing. What can I do? I don’t want to do another 100 applications just to hear nothing but if I have to do it then I will. I feel like my resume is strong. I never attach any cover letters to my applications, could this be it? I’m at a loss. Any help would be appreciated.",1590759076.0,2020-05-29 09:31:16,May
523,523,"23. Unemployed. One year out of University, cant get a career or even a job going. How screwed am I with Covid-19?",397,gm4cmq,jobs,https://www.reddit.com/r/jobs/comments/gm4cmq/23_unemployed_one_year_out_of_university_cant_get/,123,"A bit of background:

Im a 23 y/o Female and I only have ever worked casually (high school through to March this year). I worked in retail all through uni. Due to the economy here in Australia (im talking before covid19), I struggled to also get the hours I wanted in these casual positions as a 18-22 year old and probably wasnt the best worker due to my mental health issues. I tried so hard though.

From Jan-March this year I worked in administration for a not for profit. This role was only 15 hours a week and I only got it through nepotism (spent a bit under a year volunteering in that role beforehand). In this admin role, I was told that they couldnt pay me when the manager returned from her trip that was cancelled due to Covid-19, and thats why I left in March (Laid off I guess). They didnt explicitly state if it was due to not actually being able to justify my role or simply Corona-virus. I had a casual contract till Dec 2020 in this role.  I was disappointed because I found the work easy and they constantly ask me to do work for them now (Im still volunteering for them).

Anyway thats a bit of background.

Im struggling to find work in my field and I just dont know what to do. Ive suffered from serve anxiety and depression since I was in highschool.

I graduated with a Bachelor of Commerce, in International Relations and Legal Studies, with a distinction average (mid 70s average mark). The Legal Studies side is basically like 'qualifications' in legal secretary work. However, I found out too late its extremely difficult to get into legal admin work without connections. International Relations is an arts major, but the majority of my high achieving class mates are now working in grad roles for high level government departments or international organisations etc. Due to my legal studies major, I could do a J.D Law Degree in 2 years if I wanted to, but I dont really want to be a lawyer, plus Australia is super saturated with unemployed lawyers who hold average intelligence.

I found it hard to put in applications while I was finishing at uni, but between July last year (when i graduated) and November 2019, I put in about 100 applications.  70 of those would of been relevant positions to my degree. Of those 70, I had about 5 face to face interviews and about 2 phone interviews. All obviously weren't successful. A lot of these positions I couldn't get past the psychometric testing part of the application process (when they were graduate roles)

(I applied to a broad range of graduate programs in both the public and private sector- to entry level admin/sales/support positions i could use as a stepping stone.) I know its not alot, but most people with the same degree havent had this issue, and my anxiety was so bad after I while, I admit I gave up.

I stopped applying when I landed a Christmas retail position I working in up to 50 hours a week- then i moved onto the nepotism admin role in Jan. Ive been applying again from Jan this year but no Luck. Then Coronavirus hit and I just have been ignoring the entry level roles now because everyone is on a hiring freeze and focusing on graduate programs which would start next year.

Things I want to mention/clarify

1. Ive had my CV/Resume run over about 5 times with a career councillor. They think its pretty good so im not sure what else I can do. I ustilise the S.T.A.R method to demonstrate my experience/volunteering etc on my CV. Its two pages long, which is normal in Australia for graduates.
2. I  dont have an internship under my belt. I tried very hard to get an internship, literally got one in my last semester, they said 'you can start on Monday"" -then I  got a call four hours later saying they could'nt give me the internship after all. The 'big boss' didnt think he could run me through the ropes or something before he left for a holiday.. Im not sure if this was just an excuse, but this was for a professional partisan Industry chamber lol. It blew my confidence massively.
3. I have 2 years experience in 2 volunteering roles. Basically event management/fundraising and supporting refugees and migrants integrate/learn English.
4. I write each individual cover letter from scratch to suit the companies needs/utilise key words. Every, single time no matter the role.
5. Im not picky. I realise at my age, I can try anything or any industry. I just want to get my foot in the door. Like I said, I have applied to 'very top' graduate government roles- to local council admin job roles- to entry level admin jobs for small businesses to KPMG, EY etc.

I honestly think Im just a dumbass, and I will never be able to land a full time job. If I cant make it past most of the psychometric testing in these graduate jobs, it must be true, right?

Also because of my anxiety, a lot of the positions Im too afraid to apply for.  I look at the skills and experience and I freak out. An admin role asking for 3 years experience? Forget about it. I've realised I dont actually have many solid technical skills, despite, obviously a pretty much worthless degree and vague transferable skills.

Its so disheartening. Im really not sure what I should do. None of my close friends went to uni, are unemployed or work in completely different industries. My dad is a mechanic and my mum has been a home-maker for 30 years.

What should I do? Should I continue to apply for graduate roles, or focus on very low level admin/business/sales roles and go from there?

Edited: for my shocking grammar at 1am. I do apologise. Im also a pretty 'straight' person. No tattoos, piercings, crazy hair colours and I like the real trees, not the ones you smoke through a pipe.",1589846999.0,2020-05-18 20:09:59,May
544,544,"My position was cut $7,000, what should I do?",385,glhnqc,jobs,https://www.reddit.com/r/jobs/comments/glhnqc/my_position_was_cut_7000_what_should_i_do/,133,"Last week, my position was eliminated and a new position was created $7,000 lower. The company is not falling on hard times, as they opened a position at a higher pay than mine and even gave a few people raises.

I feel so devalued as someone with a degree in computer science. I knew $47,000 was a low pay, but $40,000 feels unacceptable to me and a slap in the face. I’ll still have to apply and interview for this lower position and I don’t know if I should. If I don’t apply, I’ll be unemployed as of June 1st.",1589759450.0,2020-05-17 19:50:50,May
619,619,I feel I've been unfairly targeted by companies random drug testing policy. Should I complain to HR,360,gmve7g,jobs,https://www.reddit.com/r/jobs/comments/gmve7g/i_feel_ive_been_unfairly_targeted_by_companies/,50,"Just to preface the situation, I do not smoke/do any drugs. However, I work in a small office (10 people) for a large cooperation that has a random testing policy. Since I started working here about 6 months ago, I've been pulled for 5 drug tests including the pre employment. Meanwhile, no one else in the office has been tested once. It's hard not to feel like there someone is targeting me for some reason at this point.

On the one hand, if they're paying me my normal hourly rate to go pass a piss test once a month who cares - why even bring attention to myself by complaining. But on the other hand, this does have me feeling genuinely disgruntled, especially given the fact that with the current virus situation in my area, I'm going to have to go sit in a waiting room full of sick people for an hour plus for a pointless test that I've already passed 4 times in the last 6 months when no one else has been asked to do this a single time...",1589945253.0,2020-05-19 23:27:33,May
660,660,Responding to work emails post-layoff,352,gpdny4,jobs,https://www.reddit.com/r/jobs/comments/gpdny4/responding_to_work_emails_postlayoff/,160,"I was laid off last week. Today I got an email from an old coworker asking for help with something. She has taken over my project, while I was laid off. She wasn't involved in my project to begin with, so there's a lot of stuff she doesn't know.

Her question is simple enough, but I'm worried it's going to open a door to her constantly asking me questions. Then I'll be doing work for free. Her question also seems like she put no critical thought before coming to me.

I mostly feel like the company laid me off, they can deal with whatever consequences of that without me. If they feel like they need me, they can give me my job back.

Thoughts?

Edit: it was an email from someone at work to my personal email. And this person 100% knows I was laid off. Thanks for all the feedback.

At this point, I'm considering just saying ""I don't remember without looking at the project."" And if they ask me to do that, then I'll ask a consulting fee. The question really is simple, but because it's a question that could have been easily discovered if my coworker spent a minute looking at my work, it just feels like they're testing boundaries. There's literally a note on my project that would answer her question.",1590300317.0,2020-05-24 02:05:17,May
778,778,I recently graduated with a PhD. Should I add a suffix to my LinkedIn profile?,304,gtggbw,jobs,https://www.reddit.com/r/jobs/comments/gtggbw/i_recently_graduated_with_a_phd_should_i_add_a/,101,"I'm a bit split on this. I view the PhD as a specific professional qualification that makes me eligible for certain jobs (I don't want to go into academia). I definitely don't want to be one of those people who insist on being called Doctor. However, I wonder if adding it as a suffix on a place like LinkedIn would be a neutral and immediate way to highlight the doctorate. However, at the same time, I wonder if adding it as a suffix gives off a bad impression as well. What're your opinion? My PhD was in an Engineering field, if it makes a difference.",1590883089.0,2020-05-30 19:58:09,May
843,843,Should I be thankful I managed to get a job during this pandemic even though this new job causes me so much stress?,291,grkao6,jobs,https://www.reddit.com/r/jobs/comments/grkao6/should_i_be_thankful_i_managed_to_get_a_job/,68,"I got fired from my previous job and then I found a new job but the stresssss... Ahhhh

I have to learn so many new things, memorise everything and the manager and the other workers expect me to know everything inside out and get frustrated when I don't even though I told them all I have no experience in this area... 

Should I continue this job or find a new one? Will I even be able to find a new job when businesses aren't really hiring any more? Does anyone else get stressed when they get a new job?",1590616985.0,2020-05-27 18:03:05,May
922,922,"How to get a first career job... 6 years after graduation, and 1.5 years since last job",270,gejona,jobs,https://www.reddit.com/r/jobs/comments/gejona/how_to_get_a_first_career_job_6_years_after/,110,"I've been trying for 6 years to finally get my career in Software Engineering started after graduating in 2014 with a Computer Science degree.

I have not had any relevant job experience, just work in IT Support call centers where I had absolutely zero ability to influence decisions or create any value for a company whatsoever.

Sadly, ""massive job accomplishments"", ""5 or more years of relevant industry experience"", ""knowledge of a list of languages that would take 10+ years to learn"" and ""willing to work for an hourly wage on a contract basis"" are what appear to be the main requirements for getting an entry-level Software Engineering job in my city in the Midwest US.

I'm terrified of moving, and have no idea where or how to start looking for jobs in other cities.

I have a GitHub, and I can try to post my anonymized resume here if people want me to.

I have applied to hundreds of jobs in the last few years, and have completely and utterly failed to find any employment.

I have only received two interviews with actual companies and zero offers in the last 10 months since I passed a 6-month Data Analytics course and started looking for work again.

In the year or more before that, I had about three interviews with companies, and zero offers.

The rest of my conversations were with recruiting companies that I haven't spoken to since they interviewed me for a job and said ""We will get back to you."" Guess what, they never got back to me.

I feel like my high-functioning Autism is killing any chance I have of getting a job.

I have absolutely no idea how to get to know people professionally without first having a job, and I sure as hell don't have any meaningful network to rely on.

I have literally no idea what the hell people mean when they say ""It's easy, just network with people!"" This is a completely alien concept to me. I am mentally incapable of kissing up to people to try and curry favor with them.

I feel like I'm stuck in a constant system of Catch-22s:

* I can't find a job without first having a job.

* I can't get experience without having experience.

* I can't achieve accomplishments without having accomplishments.

* I can't get a job network without having a job network.

* I can't explain my lack of social skills in interviews by saying I have autism because it would cause people to think I don't have social skills and therefore cannot do the job. That, or it would make an HR rep crap their pants in fear of litigation, causing me to be removed from consideration.

I'm just about at my wit's end, can someone please help me figure out what I need to do to break this never-ending cycle?",1588799300.0,2020-05-06 17:08:20,May
