,index,title,score,id,subreddit,url,num_comments,body,created,date_created,month
26,26,Does anyone else find LinkedIn toxic?,1505,ggagbp,jobs,https://www.reddit.com/r/jobs/comments/ggagbp/does_anyone_else_find_linkedin_toxic/,295,"I've been on LinkedIn for a while and it hasn't gotten me a job at all. In fact, it only makes me feel bad about my experience when I see other people's profiles. Most of my connections aren't exactly going to help me find a job either...

I see LinkedIn as a giant d\*ck measuring competition. **So much humblebrags.**

I've seen a lot of posts right now specifically about how times are ""so tough"" followed by how they're proud to announce their new position at Amazon or whatnot. But when you read it, their post comes across as ""Everyone doesn't have a job right now, but ***I*** do! Lucky me!!!""",1589035112.0,2020-05-09 10:38:32,May
95,95,How will I ever go back to an office?,925,gol43u,jobs,https://www.reddit.com/r/jobs/comments/gol43u/how_will_i_ever_go_back_to_an_office/,199,"Background: have engineering office job, used to be reluctant to let employees WFH. 

The past 3 months have been such a godsend, not having to drive to work, get ready, make lunch (or get takeout), and constantly be in a rush just to sit in my windowless office to work for the next 8.5 hours. I get more time with my wife, my pets, and more time to do life things.

I am dreading going back when they open the office back up. I have been super productive during this stint, often working more than 9 hours per day at a productive rate, my deliverables have shown it too. 

I almost want to make a case with my office to allow me to do this full time, as I have never had such a quality-of-life improvement for something so simple. 

Anybody else in this boat?",1590189088.0,2020-05-22 19:11:28,May
106,106,I'm going to a job interview in 2 hours -- do I wear a mask??,888,gq9aa1,jobs,https://www.reddit.com/r/jobs/comments/gq9aa1/im_going_to_a_job_interview_in_2_hours_do_i_wear/,57,"I'm not sure if wearing a mask is proper etiquette to a job interview right now... please share your thoughts!!  This is for a legal office assistant job.  Thanks!

&#x200B;

Edit: Update - I wore the mask, and once we got into the office for the interview, the chairs were well apart and I did take off the mask at that point.  I was told that the office is taking physical distancing very seriously (no one goes into another person's office, extra cleaning, etc) and the office is currently closed to the public but will be opening ""by appointment only"" in June. 

I was also told that I am welcome to wear a mask if I feel more comfortable doing so. 

And I did get the job :) ",1590434419.0,2020-05-25 15:20:19,May
181,181,"I was laid off due to COVID-19 on March 20th. Was told my position was eliminated. Today, I just found out that my previous job was listed online a week ago as “open” and is accepting applications.",710,ghny75,jobs,https://www.reddit.com/r/jobs/comments/ghny75/i_was_laid_off_due_to_covid19_on_march_20th_was/,97,"What is the best approach here?

Previous employer hasn’t reached out to notify me the position is open.

It’s listed on 5 different employment websites, so definitely not a mistake posting.

Also a very specific job with a specific title. So I know it was my previous job.",1589234073.0,2020-05-11 17:54:33,May
243,243,"Has ""faking it till you make it"" gone too far?",630,gjrour,jobs,https://www.reddit.com/r/jobs/comments/gjrour/has_faking_it_till_you_make_it_gone_too_far/,155,"I personally feel like Corporate America has become overly focused on rewarding who can be the best narcissist and con artist, and it's hurting workplace performance, integrity, morale, and those who are more honest with themselves and those around them.

The fact is that a lot of us, even those of us who are experienced, are figuring things out as we go.  Secondly, no two jobs or organizations are the same, so finding a perfect segue from one job to another is nearly impossible.  To then have to lie about your current experience or abilities to get a job, and then have to live up to these expectations, helps nobody.  

As someone who tries to be forthcoming and honest at work about expectations (and maybe a little too much so), I've seen it hurt my opportunities so many times.  Furthermore, I see people in positions that they should never be in, simply because they were better at selling the lies about where they're genuinely at with regards to skills and experience.  Their inexperience and lack of skill, as a consequence, often hurt morale and productivity of the team they are placed on or oversee.  

In contrast to this, I think the hiring process should be more transparent and forthright from all parties.  Maybe this transparency will lend more to opportunities of getting actual formalized on-the-job training, mentorship, and advancement opportunities.  If everyone isn't out there lying or faking it to get a job, then companies would have no choice but to invest in training and development if they want to find the candidates they are seeking.  Furthermore, it'd help morale and productivity on teams because then you're not dealing with the repercussions of a manager or colleague who is out of their element trying to *fake it till they make it*.   

What are your thoughts?  Has faking it till you make it gone too far in the sense that it creates an environment where the best con artist wins out, and then everyone else is forced to deal with the consequences of a poor hiring decision when there are no formal training or mentor programs in place to accommodate?

[Why Faking It Till You Make It Is Terrible Advice - Time](https://time.com/5777479/fake-it-till-make-it-advice/)",1589508725.0,2020-05-14 22:12:05,May
265,265,Why so much hate for the vanilla 9-5 office job?,596,ge1yjj,jobs,https://www.reddit.com/r/jobs/comments/ge1yjj/why_so_much_hate_for_the_vanilla_95_office_job/,336,"I (32M) see a lot of posts on reddit from people that have a job like this and absolutely hate it. As an HVAC guy that struggles with constant injuries, long hours, and generally is not good at his job, I have a hard time understanding what is so bad about it. It has a lot going for it like not having to wake up at the crack of dawn, hour long lunch, short days, not physically demanding, not dealing with the elements, and usually with decent pay. If I knew what career/education path to follow in order to have that, I would jump on it in an instant. So why so much hate for the office job? What am I missing? Also how do you get that job?",1588728079.0,2020-05-05 21:21:19,May
272,272,Should I be ashamed that I am NOT ambitious and eager to climb the career ladder?,593,gpqje6,jobs,https://www.reddit.com/r/jobs/comments/gpqje6/should_i_be_ashamed_that_i_am_not_ambitious_and/,138,"Hey there. I have been thinking about this for quite some time now. Multiple comments and interactions with various people, both from my own family, friends and colleagues over the years have prompted me to think:

**Should I be ashamed that I am NOT ambitious and eager to climb the career ladder? Am I a loser in life for not placing more emphasis on my career?**

A little background about myself. I'm a teacher, and I graduated from a UK university in 2014 with first-class honours. Since then, I have been working as a teacher at a public secondary school.

A good number of my coursemates and also other teachers all seem to be planning their career developments very aggressively, from pursuing Masters while working full-time as teachers, participating and presenting papers in seminars and conferences, creating modules, conducting camps, etc etc......while I on the other hand am pretty.....*chill* about it.

Every year, all the time that I have during school holidays is solely dedicated to planning my lessons far ahead so that  I don't have to crack my head when school is in session. You can say I'm quite obsessed with planning. I'm very organised and I absolutely hate doing ad-hoc things. In fact, I even push myself to prepare materials for the entire year of club meetings even when it's not confirmed yet if I would be the club advisor, just because I like to plan.

It has benefited me so far, and because of this, I have a fairly good work-life balance. My life for the past few years up to now has relatively little stress. I come home from work in the afternoon, exercise in the evening, then dedicate a good 2 hours to read my beloved Kindle. And that's my cycle for the entire year. I don't go the extra mile. Don't get me wrong, I absolutely finish all the tasks required of me, it's just that first,  I don't like to procrastinate and like to get things done quick and second, I'm not married, so I guess I'm lucky in the sense that I have more time.

My lack of ambition wouldn't have bothered me, if not for the fact that people in the education sector (fellow teachers) AND also people OUTSIDE the education sector seem to have this perception that teachers should be noble beings who must sacrifice for students. I'm sorry, while I do care and try to help my kids where possible, I am just not one of those teachers who live and breathe school. If I go back at 3pm, I'm not going to think about school any longer. I think about other things, like planning my weekend grocery list, which cinema movies to look out for, books to read, etc etc

Because I graduated with first-class honours, my former lecturers, coursemates and even my own family feel that I am wasting away my talent and that I should do *something*. They seem to think that I shouldn't be content with what I am doing now. It's annoying as the ""clock"" is ticking and the pressure from them is increasing in the form of off-hand comments, and in turn I am often forced to plaster the world's worst fake smile. As a result, I have begun to feel like a loser lately, like I'm drifting aimlessly even though I am satisfied and happy with my life (little stress)

**TLDR; So I am asking the rest of you, should I be more ambitious? Is something wrong with me for going against the norm? Is it even a norm that one must progress in their career?**",1590359298.0,2020-05-24 18:28:18,May
